all_awardings,archived,associated_award,author,author_created_utc,author_flair_background_color,author_flair_css_class,author_flair_richtext,author_flair_template_id,author_flair_text,author_flair_text_color,author_flair_type,author_fullname,author_patreon_flair,author_premium,body,can_gild,collapsed,collapsed_because_crowd_control,collapsed_reason,collapsed_reason_code,comment_type,controversiality,created_utc,distinguished,edited,gilded,gildings,id,is_submitter,link_id,locked,no_follow,parent_id,permalink,score,score_hidden,send_replies,stickied,subreddit,subreddit_id,subreddit_name_prefixed,subreddit_type,top_awarded_type,total_awards_received,treatment_tags,unrepliable_reason,retrieved_utc,updated_utc,body_sha1,utc_datetime_str,author_cakeday,nest_level,edited_on,author_is_blocked
[],False,,weilim,1165872750.0,,,[],,,,text,t2_uhiu,False,False,"The w[orld bank](https://data.worldbank.org/indicator/SP.URB.TOTL.IN.ZS?locations=IR). Why do you assume most Iranians live in villages?

[https://www.nature.com/articles/s41599-021-00741-w](https://www.nature.com/articles/s41599-021-00741-w)",True,False,,,,,0,1666655862,,False,0,{},itnow51,False,t3_y9trhj,False,False,40970024009.0,/r/geopolitics/comments/y9trhj/the_beginning_of_the_end_of_the_islamic_republic/itnow51/,3,False,True,False,geopolitics,t5_2qhnn,r/geopolitics,public,,0,[],,1667895276,1670705970,e989af8735a20313a32aa79e66d707d88c137527,2022-10-24 23:57:42,,,,
[],False,,[deleted],,,,,,,dark,,,,,[removed],False,True,,,DELETED,,0,1666655337,,False,0,{},itnnqvz,False,t3_y590s4,False,True,,/r/geopolitics/comments/y590s4/why_doesnt_armenia_simply_give_up_on_russia_and/itnnqvz/,3,False,True,False,geopolitics,t5_2qhnn,r/geopolitics,public,,0,[],,1667895307,1670705968,fe993932d6dced4c0a879e9aa5d7a6e0fbb467f5,2022-10-24 23:48:57,,1.0,,
[],False,,Nilas_T,1389647857.0,,,[],,,,text,t2_esoc9,False,False,/r/AgedLikeMilk,True,False,,,,,0,1666653966,,False,0,{},itnkr0a,False,t3_7g6l21,False,True,29909907116.0,/r/geopolitics/comments/7g6l21/why_is_russia_so_big_explained_in_a_nutshell/itnkr0a/,1,False,True,False,geopolitics,t5_2qhnn,r/geopolitics,public,,0,[],,1667895389,1670705961,ddead8cdfdfa59a478f0e3b0dcdc78e1ac0a4d54,2022-10-24 23:26:06,,,,
[],False,,SuperMario_All-Stars,1479616229.0,,,[],,,,text,t2_12xtjd,False,False,"They have been, look at all the collaboration in online censorship on their platforms.",True,False,,,,,0,1666651555,,False,0,{},itnfh21,False,t3_y9b7hi,False,False,,/r/geopolitics/comments/y9b7hi/big_tech_goes_to_war_to_help_ukraine_washington/itnfh21/,3,False,True,False,geopolitics,t5_2qhnn,r/geopolitics,public,,0,[],,1667895533,1670705952,2c85563927741b65c549e49eaa6972357a4d93c4,2022-10-24 22:45:55,,1.0,,
[],False,,ssilBetulosbA,1479436527.0,,,[],,,,text,t2_12w6zl,False,False,"Recently there have been a considerable amount of calls exchanged between senior NATO/US officials and Russia after not speaking for months previously. Now there is discussion of the potential usage of a dirty bomb, as well as Russians saying an escalation is imminent. Is this a sign of potential escalation and further problems?

Also - 

Do you believe this preempts the potential usage of a dirty bomb by Russia (while blaming Ukraine), to appear as a false flag and thus necessitate nuclear (or otherwise) escalation by them?

Or the usage of such a bomb by Ukrainians (while blaming Russia) in order to help create a reason for NATO intervention against Russia and further Western help? 

Or (hopefully), neither of those and no such dirty bomb will be used...",True,False,,,,,0,1666648985,,True,0,{},itn9p5j,False,t3_t020va,False,False,,/r/geopolitics/comments/t020va/russia_invasion_of_ukraine_live_thread/itn9p5j/,3,False,True,False,geopolitics,t5_2qhnn,r/geopolitics,public,,0,[],,1667895692,1670705940,ef3d8d98e7abade1f4d5a2d502e1740d258e2074,2022-10-24 22:03:05,,1.0,1666655267.0,
[],False,,[deleted],,,,,,,dark,,,,,[deleted],True,True,,,DELETED,,0,1666640302,,False,0,{},itmnms8,False,t3_t020va,False,True,,/r/geopolitics/comments/t020va/russia_invasion_of_ukraine_live_thread/itmnms8/,3,False,True,False,geopolitics,t5_2qhnn,r/geopolitics,public,,0,[],,1667896303,1670705904,228f7d207920fb84335fac5b2b06ed7b472ece9e,2022-10-24 19:38:22,,1.0,,
[],False,,MacaroonNo1,1650647275.0,,,[],,,,text,t2_lms975qu,False,False,Hahahahaha!! good joke.,True,False,,,,,0,1666634818,,False,0,{},itm9dws,False,t3_xz07ev,False,True,40970590274.0,/r/geopolitics/comments/xz07ev/us_troops_should_be_withdrawn_from_saudi_arabia/itm9dws/,1,False,True,False,geopolitics,t5_2qhnn,r/geopolitics,public,,0,[],,1667896699,1670705875,da52ec7b5a78d5f0b42ce73675e9d9cdc44966f4,2022-10-24 18:06:58,,,,
[],False,,thomaja1,1602523755.0,,,[],,,,text,t2_8g81niuj,False,False,"Look. I'm going to tell you straight up. The Republicans are in the pocket of Trump and Putin. As soon as the Republicans get back the house or the Senate, you can bet your ass they're going to try their best to stop funding this. It's what Republicans do. It's their purpose.  If I have something to do with upholding democracy or helping the little guy, Republicans are against it.

Watch, you'll see.",True,False,,,,,0,1666633052,,False,0,{},itm4t4a,False,t3_y9b7hi,False,True,40946314581.0,/r/geopolitics/comments/y9b7hi/big_tech_goes_to_war_to_help_ukraine_washington/itm4t4a/,1,False,True,False,geopolitics,t5_2qhnn,r/geopolitics,public,,0,[],,1667896825,1670705868,f24134637626d375fe14cc4a377ee0561888207d,2022-10-24 17:37:32,,,,
[],False,,Presence-AP,,,,[],,,,text,t2_tn4p8u50,False,False,"Well, the US is the largest shale oil producer. Shale oil usually processes down to Light Sweet oil. Which is only half the equation. Hence our current issues. We still require dark sour oil which we usually obtain from Russia, the Saudis or Canada. Canada production is not up to par with our demand and won't be for another decade or so as they don't have the infrastructure built. However since the majority of the top world players are trying to move towards green renewables, it puts Canada in a precarious position. Do they invest in the infrastructure for a product the majority of the world is attempting to move away from? Now argumentatively, the technology isn't there for a full transition to renewables and won't be for at least a decade. This also is going to be further postponed given the current lack of access to raw materials required for the transition.",True,False,,,,,0,1666626014,,False,0,{},itlmt0w,False,t3_y1igkf,False,True,40939221986.0,/r/geopolitics/comments/y1igkf/how_will_usa_respond_to_recent_opec_decision/itlmt0w/,1,False,True,False,geopolitics,t5_2qhnn,r/geopolitics,public,,0,[],,1667897325,1670705838,bde0920ab6b4d9eae4a94b2535257d43df578a39,2022-10-24 15:40:14,,,,
[],False,,UlagamOruvannuka,1471877983.0,,,[],,,,text,t2_10sej4,False,False,Exactly what people have been predicting since 1947.,True,False,,,,,0,1666624265,,False,0,{},itlii2c,False,t3_xzxufl,False,True,40971299871.0,/r/geopolitics/comments/xzxufl/putin_sees_pakistan_as_russias_priority_partner/itlii2c/,2,False,True,False,geopolitics,t5_2qhnn,r/geopolitics,public,,0,[],,1667897444,1670705831,26cb3a4af4042ec201b120848b3385ead0864191,2022-10-24 15:11:05,,,,
[],False,,[deleted],,,,,,,dark,,,,,[removed],True,True,,,DELETED,,0,1666620291,,False,0,{},itl95b3,False,t3_xzxufl,False,True,40971064608.0,/r/geopolitics/comments/xzxufl/putin_sees_pakistan_as_russias_priority_partner/itl95b3/,2,False,True,False,geopolitics,t5_2qhnn,r/geopolitics,public,,0,[],,1667897704,1670705814,fe993932d6dced4c0a879e9aa5d7a6e0fbb467f5,2022-10-24 14:04:51,,,,
[],False,,[deleted],,,,,,,dark,,,,,"That’s not… quite how it works. Armies defect against regimes all the time, but generally only over very specific issues. The army is usually the most nationalistic organization in any country, and it follows that it will only be loyal to a government that seems to be succeeding in pursuing nationalist aims. The Iranian government has done this quite well in the past ten years, with much of the Middle East seeming to be part of a new “Persian Empire”. Seeming is the key word because Iranian control over Iraq and Syria is looser than most believe, but the image is what is important. While domestically Iran has been floundering since the late 1970s, internationally Iran is still the “winning” party in the Gulf Cold War, and its unlikely the military will throw out a government that has succeeded in the sole domain they care about to pursue womens’ rights, economic development, etc.",False,False,,,,,0,1666618912,,False,0,{},itl62m1,False,t3_y9trhj,False,False,40953567863.0,/r/geopolitics/comments/y9trhj/the_beginning_of_the_end_of_the_islamic_republic/itl62m1/,8,False,True,False,geopolitics,t5_2qhnn,r/geopolitics,public,,0,[],,1667897802,1670705809,61b2600697d2477ea83d77db9f49c38395288447,2022-10-24 13:41:52,,,,
[],False,,oritfx,1649448631.0,,,[],,,,text,t2_joptu8mg,False,False,"I can supply 3 rationales ordered by reason, descending:

1. S&amp;P did increase Russia's rating on Feb 25th 2022 - all previous invasions did turn out to be profitable to Russia with a relatively small effort.

2. Previous invasions have been popular domestically - it was a foreign policy decision that was heavily motivated by internal policies.

3. There is a rumor that Putin sees himself and Russia as something that should play a bigger role in the world and the invasion was supposed to be another step on this path.",True,False,,,,,0,1666618268,,False,0,{},itl4p5h,False,t3_t020va,False,True,40963186203.0,/r/geopolitics/comments/t020va/russia_invasion_of_ukraine_live_thread/itl4p5h/,3,False,True,False,geopolitics,t5_2qhnn,r/geopolitics,public,,0,[],,1667897840,1670705807,5f6962a529ba7ac03e1aea84054fa844fd664e40,2022-10-24 13:31:08,,,,
[],False,,[deleted],,,,,,,dark,,,,,[removed],True,True,,,DELETED,,0,1666617991,,False,0,{},itl43s0,False,t3_xzxufl,False,True,40867748329.0,/r/geopolitics/comments/xzxufl/putin_sees_pakistan_as_russias_priority_partner/itl43s0/,3,False,True,False,geopolitics,t5_2qhnn,r/geopolitics,public,,0,[],,1667897856,1670705806,fe993932d6dced4c0a879e9aa5d7a6e0fbb467f5,2022-10-24 13:26:31,,,,
[],False,,shadowfax12221,1597250006.0,,,[],,,,text,t2_27n5u7c0,False,False,"What's the alternative? There isn't a credible one. The  Yuan lacks liquidity, the euro financed its bailouts with retail bank deposits, the Russians had a bad habit of stealing foreign assets even before the ukraine war undermined their whole economic model so the ruble is out, there literally isn't enough gold on earth to act as the global medium of exchange. 

The US has a combination of regional security, a comparatively low level of global integration, consumption led growth that allows it to offer high risk free interest rates, strong legal protections for property rights, and highly liquid capital markets that can't be matched. The dollar is the global reserve currency because holding anything else is likely to cost you money.",True,False,,,,,0,1666617077,,False,0,{},itl27bf,False,t3_xz07ev,False,True,40970579837.0,/r/geopolitics/comments/xz07ev/us_troops_should_be_withdrawn_from_saudi_arabia/itl27bf/,3,False,True,False,geopolitics,t5_2qhnn,r/geopolitics,public,,0,[],,1667897908,1670705803,60b6ae93d7544befa1e724fb55bcfc2f37e96ff7,2022-10-24 13:11:17,,,,
[],False,,morpipls,1549741151.0,,,[],,,,text,t2_36uessih,False,False,"Azerbaijan has oil and natural gas reserves, which can help reduce Europe’s dependence on Russian gas. They just recently completed a new gas pipeline to Bulgaria, for example.  They’re close allies with Turkey (who is of course a NATO member and occupies a key strategic location at the entrance to the Black Sea.) They also have strong ties to Israel (a long-standing US ally). Azerbaijan supplies something like 40% of Israel’s oil. The two also cooperate in opposing Iran.

The US has at times been more supportive of Armenia than Turkey or Azerbaijan would like, but for the US to really back Armenia against Azerbaijan would risk damaging those relationships which right now are especially important to US interests given the war in Ukraine.

As an American, I feel a lot of sympathy for the Armenian people and what they've been through, but I can't blame them for not seeing us as a particularly reliable ally.  (Then again, neither is Russia.)",True,False,,,,,0,1666615045,,False,0,{},itky831,False,t3_y590s4,False,False,,/r/geopolitics/comments/y590s4/why_doesnt_armenia_simply_give_up_on_russia_and/itky831/,18,False,True,False,geopolitics,t5_2qhnn,r/geopolitics,public,,0,[],,1667898017,1670705797,aec4cc41c7eef361e30b7dcc2f5f29af45780d96,2022-10-24 12:37:25,,1.0,,
[],False,,buy-niani,1610637918.0,,,[],,,,text,t2_9tgqhqec,False,False,You are the stereotypical westerners arrogance that will bring the World ship down,True,False,,,,,0,1666612621,,False,0,{},itktxs2,False,t3_xz07ev,False,True,40852111339.0,/r/geopolitics/comments/xz07ev/us_troops_should_be_withdrawn_from_saudi_arabia/itktxs2/,1,False,True,False,geopolitics,t5_2qhnn,r/geopolitics,public,,0,[],,1667898139,1670705788,503910f5dff55f5c474cb0bb74364f54f2fb71b3,2022-10-24 11:57:01,,,,
[],False,,buy-niani,1610637918.0,,,[],,,,text,t2_9tgqhqec,False,False,"Said 20% of humanity?
How arrogant ignorant people can be!
Do you think with all honesty that the international monetary system is credible by itself?
If even China wants it will go down overnight",True,False,,,,,0,1666612487,,False,0,{},itktpq5,False,t3_xz07ev,False,False,40851930000.0,/r/geopolitics/comments/xz07ev/us_troops_should_be_withdrawn_from_saudi_arabia/itktpq5/,1,False,True,False,geopolitics,t5_2qhnn,r/geopolitics,public,,0,[],,1667898145,1670705788,a7d76ca2d93a9cd5d1ef10dae199b20d66a19155,2022-10-24 11:54:47,,,,
[],False,,theavenuehouse,1322498664.0,,,[],,,,text,t2_6buxo,False,False,"I'd be a bit nervous about what comes next to call it ''good news'. From all the government collapses and revolutions I can think of in the last 20 years, I can't think of one that has led to a successful democracy. I'm probably missing one, but on the whole it's led to civil wars, Juntas, invasions, or another dictator.",True,False,,,,,0,1666611347,,False,0,{},itkrvmu,False,t3_y3v4dt,False,True,40894516596.0,/r/geopolitics/comments/y3v4dt/party_of_one_the_ccp_congress_and_xi_jinpings/itkrvmu/,2,False,True,False,geopolitics,t5_2qhnn,r/geopolitics,public,,0,[],,1667898196,1670705785,e7422db3792dd4c206d8f82807aeb036e8528716,2022-10-24 11:35:47,,,,
[],False,,aRationalMoose,1437779280.0,,,[],,,,text,t2_p1x76,False,False,"Seems improbable. 

My personal take is that democracies have an obligation to defend each other against aggressors. It sends a message to china that the US will act to defend its friendlies(at least, with a democrat in the White House, I am having a tough time gaging what GOP policy would be here, trump aside) which I think is important as they ramp up their aggression around Taiwan. It also shows America is still willing to be active abroad and assist in their interests, something which disappeared entirely under trump who had nothing but disdain for our alliances. 

Beyond that, degrading Russian capabilities is nothing but net benefits. It makes them a weaker ally to many of americas potential adversaries, including those in Asia and the Middle East. 

Finally, it’s also the moral thing to do, and it shows that America is still a force for good. You can’t use methods from the 19th century to wage a war from the 20th century. Genocide should be a no go. The US coming to Ukraine’s aid has helped rally democracies abroad and strengthen alliances and provide a shared sense of cause. 

It’s not without its challenges— I think concerns about tactical nuclear weapons are legitimate for example. But I do think it’s the right thing to do.",True,False,,,,,0,1666606631,,True,0,{},itkldx5,False,t3_y9b7hi,False,True,40969241749.0,/r/geopolitics/comments/y9b7hi/big_tech_goes_to_war_to_help_ukraine_washington/itkldx5/,0,False,True,False,geopolitics,t5_2qhnn,r/geopolitics,public,,0,[],,1667898372,1670705772,f721903815a41aa96ca98e794ecfeacf7f9a3c3a,2022-10-24 10:17:11,,,1667128929.0,
[],False,,Limburger52,1622061550.0,,,[],,,,text,t2_ccnq5po0,False,False,May I enquire as to the source of your stats? I also am curious as to what qualifies as “urban” in that country.,True,False,,,,,0,1666603536,,False,0,{},itkhsuh,False,t3_y9trhj,False,False,40951871453.0,/r/geopolitics/comments/y9trhj/the_beginning_of_the_end_of_the_islamic_republic/itkhsuh/,5,False,True,False,geopolitics,t5_2qhnn,r/geopolitics,public,,0,[],,1667898469,1670705766,d17fea0eb35cbbfdb50f2d856023110f8c31e5fa,2022-10-24 09:25:36,,,,
[],False,,Limburger52,1622061550.0,,,[],,,,text,t2_ccnq5po0,False,False,"It would seem we have an expert in our midst. Seeing as you claim the right of declaring others as being ignorant, it is only just and fitting that you put your money where your mouth is and enlighten us. Dazzle me with your brilliance!",True,False,,,,,0,1666603240,,False,0,{},itkhgv0,False,t3_y9trhj,False,False,40954951584.0,/r/geopolitics/comments/y9trhj/the_beginning_of_the_end_of_the_islamic_republic/itkhgv0/,1,False,True,False,geopolitics,t5_2qhnn,r/geopolitics,public,,0,[],,1667898478,1670705766,191712273588423becc2602d5fc7eff073216d50,2022-10-24 09:20:40,,,,
[],False,,tommycahil1995,1471830953.0,,,[],,,,text,t2_10ryt4,False,False,Some of them are still public but my channel went in a different direction so I privated some of them,True,False,,,,,0,1666601153,,False,0,{},itkf5ic,False,t3_bmibsk,False,True,40967753169.0,/r/geopolitics/comments/bmibsk/what_are_your_favourite_youtube_channels_that/itkf5ic/,1,False,True,False,geopolitics,t5_2qhnn,r/geopolitics,public,,0,[],,1667898541,1670705761,6ae6d1c07db4f62551cbb70c758128731999756b,2022-10-24 08:45:53,,,,
[],False,,Techiedelic,1590158369.0,,,[],,,,text,t2_6jriw4fs,False,False,Maybe if they finally do something with that laptop we’ll learn more about their business dealings in Ukraine that has us so invested.,True,False,,,,,0,1666589363,,False,0,{},itk1191,False,t3_y9b7hi,False,True,40946181477.0,/r/geopolitics/comments/y9b7hi/big_tech_goes_to_war_to_help_ukraine_washington/itk1191/,2,False,True,False,geopolitics,t5_2qhnn,r/geopolitics,public,,0,[],,1667898925,1670705737,c2bdbafb33cd1a9b40e7d032f8c03592b7440cd9,2022-10-24 05:29:23,,,,
[],False,,OnlyImmortal69420,1640113627.0,,,[],,,,text,t2_hsn2qork,False,False,Finally! As an American I cant wait until the day we can Ally with Iran to finally end the evils of saudi arabia instead of begging them for oil.,True,False,,,,,0,1666587734,,False,0,{},itjyoce,False,t3_y9trhj,False,True,,/r/geopolitics/comments/y9trhj/the_beginning_of_the_end_of_the_islamic_republic/itjyoce/,2,False,True,False,geopolitics,t5_2qhnn,r/geopolitics,public,,0,[],,1667898990,1670705734,696bbeea37505cd562f15973133223719f4ce7b1,2022-10-24 05:02:14,,1.0,,
[],False,,TaciturnIncognito,1651714348.0,,,[],,,,text,t2_mpv4zq3u,False,False,Last time this happened I remember when they literally surrounded a group of protestors and shot them all in a ring,True,False,,,,,0,1666587154,,False,0,{},itjxt16,False,t3_y9trhj,False,True,40950460792.0,/r/geopolitics/comments/y9trhj/the_beginning_of_the_end_of_the_islamic_republic/itjxt16/,3,False,True,False,geopolitics,t5_2qhnn,r/geopolitics,public,,0,[],,1667899013,1670705732,bf75a621df771ddbc60c4bfe415df0cf786c3420,2022-10-24 04:52:34,,,,
[],False,,TaciturnIncognito,1651714348.0,,,[],,,,text,t2_mpv4zq3u,False,False,"It won't help when they are being shot in the street. People get the message pretty quickly and stop showing up.

Popular uprisings require either the military to collapse or a coup de tat. The Iranian Revolutionary Guard specifically exists to prevent that. They will be willing to shoot to kill. There is nothing showing that the conventional wing of the military is willing to attempt a coup either, and they  would have to fight through the revolutionary guard",True,False,,,,,0,1666587031,,False,0,{},itjxm9l,False,t3_y9trhj,False,False,40954026264.0,/r/geopolitics/comments/y9trhj/the_beginning_of_the_end_of_the_islamic_republic/itjxm9l/,6,False,True,False,geopolitics,t5_2qhnn,r/geopolitics,public,,0,[],,1667899018,1670705732,2eedcdb828fb830a3f961a1c86c8c41fb8ed3206,2022-10-24 04:50:31,,,,
[],False,,FunnyDude9999,1475106127.0,,,[],,,,text,t2_11qq9f,False,False,This is the correct answer.,True,False,,,,,0,1666585801,,False,0,{},itjvnik,False,t3_ya46ss,False,False,40954914249.0,/r/geopolitics/comments/ya46ss/why_isnt_canada_taking_advantage_of_russias/itjvnik/,4,False,True,False,geopolitics,t5_2qhnn,r/geopolitics,public,,0,[],,1667899072,1670705728,9b35d163aa7efb2ebd7eca2b623e6331603be0dc,2022-10-24 04:30:01,,,,
[],False,,Geneaux,1395443450.0,,,[],,,,text,t2_fsqhl,False,False,"Geography exists yo. Armenia is a land-locked nation with no access to sea or ocean-bound ports. Georgia is it's main source of imports, ie Russia again. Positive relations with Iran too, but what can you do with that? This leaves Turkey, who blockades Armenia to keep them weakened. NATO isn't going to put it's name on anything Armenia because that requires Turkey's seal of approval, like most NATO endeavors in that part of the world. Turkey plays fast and loose because they sit between the Middle East, the Mediterranean, and the USSR/Russia's backyard, while still overseeing access to Europe. Which leaves any aid Armenia gets to individual nations on a whim. Like the US who sent a measly $41K USD in counternarcotics assistance vs Azerbaijan's $8.5M USD from 2005 to 2016 as an example. 

Also the current prevailing Turkish historical revisionism that sweeps the Armenian Genocide under-the-rug sort of makes this impossible from the get-go.",True,False,,,,,0,1666582287,,False,0,{},itjpenu,False,t3_y590s4,False,False,,/r/geopolitics/comments/y590s4/why_doesnt_armenia_simply_give_up_on_russia_and/itjpenu/,25,False,True,False,geopolitics,t5_2qhnn,r/geopolitics,public,,0,[],,1667899244,1670705718,8767cfc65e2a8cb0eb4dd6c1f533febe996351ca,2022-10-24 03:31:27,,1.0,,
[],False,,PenceKamala2024,,,,[],,,,text,t2_rwagatx4,False,False,Let’s be real. Without tech advancements no one is hitting their climate targets. There isn’t enough raw material for the world to go renewable. With Germany reverting to lignite coal and and EU burning wood natural gas and oil is the low carbon energy source.,True,False,,,,,0,1666579460,,False,0,{},itjjqpr,False,t3_ya46ss,False,False,40956309847.0,/r/geopolitics/comments/ya46ss/why_isnt_canada_taking_advantage_of_russias/itjjqpr/,8,False,True,False,geopolitics,t5_2qhnn,r/geopolitics,public,,0,[],,1667899399,1670705707,f7726b40cc9c3979bdf6d98ebe04a2edf79f9c20,2022-10-24 02:44:20,,,,
