all_awardings,archived,associated_award,author,author_created_utc,author_flair_background_color,author_flair_css_class,author_flair_richtext,author_flair_template_id,author_flair_text,author_flair_text_color,author_flair_type,author_fullname,author_patreon_flair,author_premium,body,can_gild,collapsed,collapsed_because_crowd_control,collapsed_reason,collapsed_reason_code,comment_type,controversiality,created_utc,distinguished,edited,gilded,gildings,id,is_submitter,link_id,locked,no_follow,parent_id,permalink,score,score_hidden,send_replies,stickied,subreddit,subreddit_id,subreddit_name_prefixed,subreddit_type,top_awarded_type,total_awards_received,treatment_tags,unrepliable_reason,retrieved_utc,updated_utc,body_sha1,utc_datetime_str,author_cakeday,nest_level,edited_on,author_is_blocked
[],False,,grqb,1649076719.0,,,[],,,,text,t2_inylh1fh,False,False,"Or just make it too costly for Russia to stay there. Afghanistan and Vietnam didn’t occupy Washington, or even defeat the US army.",True,False,,,,,0,1666977007,,False,0,{},iu57fs4,False,t3_yfsod4,False,False,41004662961.0,/r/geopolitics/comments/yfsod4/dont_rule_out_diplomacy_in_ukraine_bidens_current/iu57fs4/,17,False,True,False,geopolitics,t5_2qhnn,r/geopolitics,public,,0,[],,1667869464,1670707217,6db1bec2b91269d3bfeacc13d59b3a84e395f7ca,2022-10-28 17:10:07,,,,
[],False,,Electronic_Ad5481,1599346342.0,,,[],,,,text,t2_78sug3fm,False,True,"You know they would never say that had the US actually annexed part of Iraq of Afghanistan. Articles like these are not in good faith, they are either tankies trying to help Russian imperialism or far left ideologies who want to try and move the Overton window so that America=bad.",True,False,,,,,0,1666976982,,False,0,{},iu57ddw,False,t3_yfsod4,False,False,41004562994.0,/r/geopolitics/comments/yfsod4/dont_rule_out_diplomacy_in_ukraine_bidens_current/iu57ddw/,38,False,True,False,geopolitics,t5_2qhnn,r/geopolitics,public,,0,[],,1667869467,1670707216,c36514f75b9e99a3ec3b3bd50146ae3a9fd6d741,2022-10-28 17:09:42,,,,
[],False,,[deleted],,,,,,,dark,,,,,[removed],True,True,,,DELETED,,0,1666976928,,False,0,{},iu578iv,False,t3_yfsod4,False,True,41004764956.0,/r/geopolitics/comments/yfsod4/dont_rule_out_diplomacy_in_ukraine_bidens_current/iu578iv/,1,False,True,False,geopolitics,t5_2qhnn,r/geopolitics,public,,0,[],,1667869473,1670707216,fe993932d6dced4c0a879e9aa5d7a6e0fbb467f5,2022-10-28 17:08:48,,,,
[],False,,[deleted],,,,,,,dark,,,,,[removed],True,True,,,DELETED,,0,1666976843,,False,0,{},iu570ql,False,t3_yfsod4,False,True,41004764956.0,/r/geopolitics/comments/yfsod4/dont_rule_out_diplomacy_in_ukraine_bidens_current/iu570ql/,1,False,True,False,geopolitics,t5_2qhnn,r/geopolitics,public,,0,[],,1667869483,1670707216,fe993932d6dced4c0a879e9aa5d7a6e0fbb467f5,2022-10-28 17:07:23,,,,
[],False,,feedmytv,1360987917.0,,,[],,,,text,t2_am7sl,False,False,drones can´t cross borders right,True,False,,,,,0,1666976609,,False,0,{},iu56f4s,False,t3_yfsod4,False,True,41004665655.0,/r/geopolitics/comments/yfsod4/dont_rule_out_diplomacy_in_ukraine_bidens_current/iu56f4s/,-1,False,True,False,geopolitics,t5_2qhnn,r/geopolitics,public,,0,[],,1667869511,1670707215,4426975049815ab15f79b8e8bce63f2b64d86f8f,2022-10-28 17:03:29,,,,
[],False,,Risay117,1347402990.0,,,[],,,,text,t2_8zaty,False,False,"Umm Fort Hills is an open pit mine that in the third article has a cost per barrel being $37, an increase from their previous guidance of $25 to $29 a barrel.",True,True,,,,,0,1666976601,,False,0,{},iu56egz,False,t3_ya46ss,False,True,41004739377.0,/r/geopolitics/comments/ya46ss/why_isnt_canada_taking_advantage_of_russias/iu56egz/,1,False,True,False,geopolitics,t5_2qhnn,r/geopolitics,public,,0,[],,1667869512,1670707215,d538a24f2ddc1de9d447631469a94fbaf70f1c90,2022-10-28 17:03:21,,,,
[],False,,LiberalAspergers,1569260905.0,,,[],,,,text,t2_4ng80vta,False,False,"The below ground steam injection wells have lower costs than the open pit mines. You are correct for the steam injection wells. The open pit operations are still significantly higher, which is why there has been less investment in those fields.",True,False,,,,,0,1666976394,,False,0,{},iu55ve9,False,t3_ya46ss,False,False,41003638367.0,/r/geopolitics/comments/ya46ss/why_isnt_canada_taking_advantage_of_russias/iu55ve9/,2,False,True,False,geopolitics,t5_2qhnn,r/geopolitics,public,,0,[],,1667869537,1670707213,b86eaf018b75f3fa972dd27a184b9671911512f9,2022-10-28 16:59:54,,,,
[],False,,babushkalauncher,1657860617.0,,,[],,,,text,t2_q15gke0t,False,False,Turkey’s fertility rate is inching towards going below replacement level. The only reason it’s above replacement level is the high birth rates in the Kurdish regions. Western Turkey has a birth rate on par with France.,True,False,,,,,0,1666976372,,False,0,{},iu55te7,False,t3_yem57k,False,False,41002011509.0,/r/geopolitics/comments/yem57k/were_8_months_into_the_ukraine_war_with_recent/iu55te7/,5,False,True,False,geopolitics,t5_2qhnn,r/geopolitics,public,,0,[],,1667869539,1670707213,b7f756652f4b38f04502487873c169dd3f5cd4aa,2022-10-28 16:59:32,,,,
[],False,,ICLazeru,1595803101.0,,,[],,,,text,t2_7fc29xjn,False,False,"Indeed, and what then would we do when countries more potent than Russia seek to sate their hunger?",True,False,,,,,0,1666976363,,False,0,{},iu55sll,False,t3_yfsod4,False,False,41004622444.0,/r/geopolitics/comments/yfsod4/dont_rule_out_diplomacy_in_ukraine_bidens_current/iu55sll/,9,False,True,False,geopolitics,t5_2qhnn,r/geopolitics,public,,0,[],,1667869540,1670707213,2c38ff1d667b15a295131d548cf2b30c08736e93,2022-10-28 16:59:23,,,,
[],False,,babushkalauncher,1657860617.0,,,[],,,,text,t2_q15gke0t,False,False,"A lot of European countries will not face a situation like Italy because they have higher birth rates and high immigration levels. For instance, the UK, France and the Nordic countries will all see their populations increase in the coming decades.

The real demographic time bomb is east Europe.",True,False,,,,,0,1666976315,,False,0,{},iu55o7q,False,t3_yem57k,False,True,41001247851.0,/r/geopolitics/comments/yem57k/were_8_months_into_the_ukraine_war_with_recent/iu55o7q/,1,False,True,False,geopolitics,t5_2qhnn,r/geopolitics,public,,0,[],,1667869545,1670707212,8f8f95569973dc43c8271bac70ebc8d8bf617d84,2022-10-28 16:58:35,,,,
[],False,,ICLazeru,1595803101.0,,,[],,,,text,t2_7fc29xjn,False,False,"The article strikes me as somewhat deceptive, or naive, considering that several of the points they make were already completely broken down or irrelevabt before the invasion ever started.

The US spends tremendous amounts on the military, and this conflict hasn't changed that.  If anything, the insight gained is considered tremendously valuable in its own right.  The US can make detailed observations of Russian tactics and true capabilities, and tweak its own technology after real life use.  The small dent in the US budget is easily paid for in terms of defense, by this valuable information.

Additionally the US and Russia have both been distancing themselves from arms control for years now.  The trend was already there, and Putin showed no signs of changing his tune even before the invasion.  

US-Russian relations have been bad for years now, even boot-licker Trump couldn't meaningfully change that.  The west has always been suspicious of Putin, and his constant acts of aggression and meddling did nothing to quell those feelings.

In terms of economic damage, yes there is some, but even if peace broke out tomorrow, Europe is still hard on course to ween itself off of Russian fuel, and Ukraine is already severely damaged.  At this point, it is less a question of how much damage gas been done, and more of how quickly they can rebuild.  

All-in-all the article smacks of an impossible level of naivety, which is actually its thin veil disguise trying to pass of it's Moscow backed messaging.  Rubles aren't completely useless yet.",True,False,,,,,0,1666976278,,False,0,{},iu55krm,False,t3_yfsod4,False,False,41004492123.0,/r/geopolitics/comments/yfsod4/dont_rule_out_diplomacy_in_ukraine_bidens_current/iu55krm/,6,False,True,False,geopolitics,t5_2qhnn,r/geopolitics,public,,0,[],,1667869549,1670707212,487082545e819b7c2d37fad763dd472f3c9f44b0,2022-10-28 16:57:58,,,,
[],False,,Ziatoslas,1632870073.0,,,[],,,,text,t2_eobbv7ap,False,False,Wasn’t aware that the RAND CORPORATION was a Russia state affiliated think tank. Thanks for the inside info!,True,False,,,,,0,1666975813,,False,0,{},iu54eau,False,t3_yfsod4,False,False,41004474539.0,/r/geopolitics/comments/yfsod4/dont_rule_out_diplomacy_in_ukraine_bidens_current/iu54eau/,34,False,True,False,geopolitics,t5_2qhnn,r/geopolitics,public,,0,[],,1667869605,1670707210,4914fd84122d6c40efe74bf6d42d378b32004695,2022-10-28 16:50:13,,,,
[],False,,st1ck-n-m0ve,1549104154.0,,,[],,,,text,t2_34wx3m1o,False,False,No theyre not theyre in Romania… Romania is a whole other country than ukraine.,True,False,,,,,0,1666975772,,False,0,{},iu54aif,False,t3_yfsod4,False,False,41004647334.0,/r/geopolitics/comments/yfsod4/dont_rule_out_diplomacy_in_ukraine_bidens_current/iu54aif/,5,False,True,False,geopolitics,t5_2qhnn,r/geopolitics,public,,0,[],,1667869610,1670707210,a6c153fbb751e558b8c63e44b2c14c9eeaa1e137,2022-10-28 16:49:32,,,,
[],False,,Ellebellemig,1503725382.0,,,[],,,,text,t2_brc8cy4,False,False,"It is geopolitics to state that if Ukraine has a 2000 miles border to the empire invading it, the solution will at some point involve diplomacy. 
The only alternative is defeating the russian army and occupy Moscow, which - because of nuclear weapons - is not possible.",True,False,,,,,0,1666975750,,False,0,{},iu548fl,False,t3_yfsod4,False,False,41004474539.0,/r/geopolitics/comments/yfsod4/dont_rule_out_diplomacy_in_ukraine_bidens_current/iu548fl/,8,False,True,False,geopolitics,t5_2qhnn,r/geopolitics,public,,0,[],,1667869612,1670707210,272743540219b7b0c9964a661585e8f15ff126d5,2022-10-28 16:49:10,,,,
[],False,,[deleted],,,,,,,dark,,,,,[removed],True,True,,,DELETED,,0,1666975699,,False,0,{},iu543uj,False,t3_yfsod4,False,True,41004647334.0,/r/geopolitics/comments/yfsod4/dont_rule_out_diplomacy_in_ukraine_bidens_current/iu543uj/,1,False,True,False,geopolitics,t5_2qhnn,r/geopolitics,public,,0,[],,1667869618,1670707209,fe993932d6dced4c0a879e9aa5d7a6e0fbb467f5,2022-10-28 16:48:19,,,,
[],False,,coach_nassar,1570719680.0,,,[],,,,text,t2_4ropl1jy,False,False,The US 101st airborne has boots on the ground,True,False,,,,,0,1666975617,,False,0,{},iu53wdi,False,t3_yfsod4,False,False,41004586931.0,/r/geopolitics/comments/yfsod4/dont_rule_out_diplomacy_in_ukraine_bidens_current/iu53wdi/,-4,False,True,False,geopolitics,t5_2qhnn,r/geopolitics,public,,0,[],,1667869628,1670707209,1394faadc3126f4ca20ee79100526aa8d3d127f8,2022-10-28 16:46:57,,,,
[],False,,[deleted],,,,,,,dark,,,,,[removed],True,True,,,DELETED,,0,1666975418,,False,0,{},iu53ed3,False,t3_yfsod4,False,True,41004526767.0,/r/geopolitics/comments/yfsod4/dont_rule_out_diplomacy_in_ukraine_bidens_current/iu53ed3/,2,False,True,False,geopolitics,t5_2qhnn,r/geopolitics,public,,0,[],,1667869651,1670707208,fe993932d6dced4c0a879e9aa5d7a6e0fbb467f5,2022-10-28 16:43:38,,,,
[],False,,CommandoDude,1352416602.0,,,[],,,,text,t2_9jqno,False,False,"Allowing the world to slip back into a pre-ww2 world order would be a mistake for this reason.

A successful prosecution of the war by Russia will reopen the idea of war for territorial conquest.",True,False,,,,,0,1666975405,,False,0,{},iu53d64,False,t3_yfsod4,False,False,41004575853.0,/r/geopolitics/comments/yfsod4/dont_rule_out_diplomacy_in_ukraine_bidens_current/iu53d64/,30,False,True,False,geopolitics,t5_2qhnn,r/geopolitics,public,,0,[],,1667869652,1670707208,bcbf24622078a7a7b4f190d0807a92c499b073ce,2022-10-28 16:43:25,True,,,
[],False,,ICLazeru,1595803101.0,,,[],,,,text,t2_7fc29xjn,False,False,Not forever though.  Just until Putin is broken.,True,False,,,,,0,1666975115,,False,0,{},iu52mvg,False,t3_yfsod4,False,True,41004541585.0,/r/geopolitics/comments/yfsod4/dont_rule_out_diplomacy_in_ukraine_bidens_current/iu52mvg/,4,False,True,False,geopolitics,t5_2qhnn,r/geopolitics,public,,0,[],,1667869685,1670707207,d455a4b124c976eed0740190bf123a952720e211,2022-10-28 16:38:35,,,,
[],False,,st1ck-n-m0ve,1549104154.0,,,[],,,,text,t2_34wx3m1o,False,False,"It really doesnt risk forever war because the us isnt fighting. All were doing is supplying weapons and we can pretty easily stop that whenever we want. If public opinion turns, the weapons flow can just be turned off. Its much harder to stop when youre actually fighting.",True,False,,,,,0,1666975104,,False,0,{},iu52lrn,False,t3_yfsod4,False,False,41004541585.0,/r/geopolitics/comments/yfsod4/dont_rule_out_diplomacy_in_ukraine_bidens_current/iu52lrn/,5,False,True,False,geopolitics,t5_2qhnn,r/geopolitics,public,,0,[],,1667869686,1670707207,f6fce236cbfc821637b96d9f3ea5b1b5d4477fd5,2022-10-28 16:38:24,,,,
[],False,,st1ck-n-m0ve,1549104154.0,,,[],,,,text,t2_34wx3m1o,False,False,"It really doesnt risk forever war because the us isnt fighting. All were doing is supplying weapons and we can pretty easily stop that whenever we want. If public opinion turns, the weapons flow can just be turned off. Its much harder to stop when youre actually fighting.",True,False,,,,,0,1666975074,,False,0,{},iu52j4d,False,t3_yfsod4,False,False,,/r/geopolitics/comments/yfsod4/dont_rule_out_diplomacy_in_ukraine_bidens_current/iu52j4d/,17,False,True,False,geopolitics,t5_2qhnn,r/geopolitics,public,,0,[],,1667869690,1670707207,f6fce236cbfc821637b96d9f3ea5b1b5d4477fd5,2022-10-28 16:37:54,,1.0,,
[],False,,ICLazeru,1595803101.0,,,[],,,,text,t2_7fc29xjn,False,False,Diplomacy can't allow the legitimization of blatant theft and aggression.,True,False,,,,,0,1666975008,,False,0,{},iu52d7x,False,t3_yfsod4,False,False,,/r/geopolitics/comments/yfsod4/dont_rule_out_diplomacy_in_ukraine_bidens_current/iu52d7x/,49,False,True,False,geopolitics,t5_2qhnn,r/geopolitics,public,,0,[],,1667869697,1670707206,bcc3099132327fa54081ad491e93916b8f65c421,2022-10-28 16:36:48,,1.0,,
[],False,,[deleted],,,,,,,dark,,,,,[removed],True,True,,,DELETED,,0,1666974985,,False,0,{},iu52b7q,False,t3_yfsod4,False,True,41004541585.0,/r/geopolitics/comments/yfsod4/dont_rule_out_diplomacy_in_ukraine_bidens_current/iu52b7q/,1,False,False,False,geopolitics,t5_2qhnn,r/geopolitics,public,,0,[],,1667869700,1670707206,fe993932d6dced4c0a879e9aa5d7a6e0fbb467f5,2022-10-28 16:36:25,,,,
[],False,,EsMutIng,1486692493.0,,,[],,,,text,t2_1591bl,False,False,"This is what I don't understand with these kinds of articles. They're basically saying: just let aggressors take a bit. And then another bit. And then another bit. (Ossetia, Crimea, Donbas). Just get them to agree to stop right now - a break, if you will. And each time, we can go back to normal.

I mean, if we take the criticism against ""forever war"" seriously, then Biden should just provide Kyiv with even better weapons, so that they can completely destroy Russia's military and kick Russia completely out of Ukraine. End of forever war. \[edit: spelling, geography\]",True,False,,,,,0,1666974898,,True,0,{},iu523aq,False,t3_yfsod4,False,False,,/r/geopolitics/comments/yfsod4/dont_rule_out_diplomacy_in_ukraine_bidens_current/iu523aq/,108,False,True,False,geopolitics,t5_2qhnn,r/geopolitics,public,,0,[],,1667869710,1670707206,9b7931d6145074a79a54df6389412c7ff43b39e7,2022-10-28 16:34:58,,1.0,1666980368.0,
[],False,,DetlefKroeze,1289438070.0,,,[],,,,text,t2_4ier2,False,False,For months before the invasion the US tried to get Putin to pull his troops back.,True,False,,,,,0,1666974741,,False,0,{},iu51p2n,False,t3_yfsod4,False,False,41004526767.0,/r/geopolitics/comments/yfsod4/dont_rule_out_diplomacy_in_ukraine_bidens_current/iu51p2n/,5,False,True,False,geopolitics,t5_2qhnn,r/geopolitics,public,,0,[],,1667869728,1670707205,9981bd8ea500a41a4fdec6f6629913da8f553f32,2022-10-28 16:32:21,,,,
[],False,,[deleted],,,,,,,dark,,,,,[removed],True,True,,,DELETED,,1,1666974716,,True,0,{},iu51ms1,False,t3_yfsod4,False,True,,/r/geopolitics/comments/yfsod4/dont_rule_out_diplomacy_in_ukraine_bidens_current/iu51ms1/,-3,False,True,False,geopolitics,t5_2qhnn,r/geopolitics,public,,0,[],,1667869731,1670707205,fe993932d6dced4c0a879e9aa5d7a6e0fbb467f5,2022-10-28 16:31:56,,1.0,1666978727.0,
[],False,,TheRedHand7,1366395185.0,,,[],,,,text,t2_bdoo7,False,False,Exactly. It was already tried. Russia already agreed to never invade Ukraine. You can see what their words are worth.,True,False,,,,,0,1666974703,,False,0,{},iu51lou,False,t3_yfsod4,False,False,41004506432.0,/r/geopolitics/comments/yfsod4/dont_rule_out_diplomacy_in_ukraine_bidens_current/iu51lou/,24,False,True,False,geopolitics,t5_2qhnn,r/geopolitics,public,,0,[],,1667869732,1670707205,aef0472aa82132efaeaa222cad5ecbf00f8c5381,2022-10-28 16:31:43,,,,
[],False,,Publius82,1207108169.0,,,[],,,,text,t2_34bkl,False,False,"&gt;the United States could be doing more to enable diplomacy. 

Such as what, Foreign Affairs mag?",True,False,,,,,0,1666974670,,False,0,{},iu51imy,False,t3_yfsod4,False,False,41004492123.0,/r/geopolitics/comments/yfsod4/dont_rule_out_diplomacy_in_ukraine_bidens_current/iu51imy/,6,False,True,False,geopolitics,t5_2qhnn,r/geopolitics,public,,0,[],,1667869737,1670707205,baf166d15da7117f51777c94d19f6a57d2023182,2022-10-28 16:31:10,,,,
[],False,,[deleted],,,,,,,dark,,,,,[removed],True,True,,,DELETED,,0,1666974589,,False,0,{},iu51bcf,False,t3_yfsod4,False,True,,/r/geopolitics/comments/yfsod4/dont_rule_out_diplomacy_in_ukraine_bidens_current/iu51bcf/,-3,False,True,False,geopolitics,t5_2qhnn,r/geopolitics,public,,0,[],,1667869746,1670707204,fe993932d6dced4c0a879e9aa5d7a6e0fbb467f5,2022-10-28 16:29:49,,1.0,,
[],False,,Disastrous_Use_7353,1645664063.0,,,[],,,,text,t2_k0cqymqe,False,False,Diplomacy with Putin? Right,True,False,,,,,0,1666974417,,False,0,{},iu50vnk,False,t3_yfsod4,False,False,,/r/geopolitics/comments/yfsod4/dont_rule_out_diplomacy_in_ukraine_bidens_current/iu50vnk/,26,False,True,False,geopolitics,t5_2qhnn,r/geopolitics,public,,0,[],,1667869766,1670707203,1629cf05bf17071e5ca93124b1b3a26a3bec70dd,2022-10-28 16:26:57,,1.0,,
[],False,,ForeignAffairsMag,1517328171.0,,,[],,,,text,t2_ul8z7s8,False,False,"\[SS from the essay by Samuel Charap, Senior Political Scientist at the RAND Corporation; and Miranda Priebe, Senior Political Scientist and Director of the Center for Analysis of U.S. Grand Strategy at the RAND Corporation.\]

Barring regime change, the likely pathways forward given current Ukrainian, U.S. and allied policies are either Russian escalation, as noted above, or a conflict of indefinite duration. A protracted war could benefit Washington to the extent that it weakens Moscow and forces it to pare back its ambitions elsewhere. But a war that drags on would also have significant downsides for the United States. It would continue to eat up military and financial resources as well as the time and energy of U.S. policymakers, diminishing Washington’s ability to prioritize long-term strategic competition with China. A protracted conflict would likely also sustain the deep freeze in U.S.-Russian relations, potentially jeopardizing cooperation between Washington and Moscow on issues of global importance, such as arms control.  
A long war would also disrupt the global economy. The United States’ most important trading partners and allies in Europe would be the hardest hit, mainly because of higher energy prices. And, of course, the country that would suffer the most—in terms of lives lost, infrastructure destroyed, and economic devastation—is Ukraine. Even a conflict that continues at a lower level of intensity would disrupt the economy and scare off investment, complicating the country’s economic recovery.  
In an op-ed in The New York Times in May, Biden wrote that U.S. military assistance to Ukraine was intended to put the country’s leaders in “in the strongest possible position at the negotiating table.” Quoting Ukrainian President Volodymyr Zelensky, he wrote that “ultimately this war ‘will only definitively end through diplomacy.’” Five months later, that diplomacy has yet to materialize—a fact for which Russia bears primary responsibility.  
But the United States could be doing more to enable diplomacy.",True,True,,comment score below threshold,LOW_SCORE,,0,1666974293,,False,0,{},iu50km3,True,t3_yfsod4,False,True,,/r/geopolitics/comments/yfsod4/dont_rule_out_diplomacy_in_ukraine_bidens_current/iu50km3/,-5,False,True,False,geopolitics,t5_2qhnn,r/geopolitics,public,,0,[],,1667869780,1670707203,37e4ddbc56cf06f7f8b0977653c0d6408c8612a6,2022-10-28 16:24:53,,1.0,,
[],False,,bravetailor,1514156275.0,,,[],,,,text,t2_cmkw1l4,False,False,"I always assume any kind of diplomacy that ever happens is usually behind the scenes and not out in the open. Almost every country likes to put out a ""strong"" public front. Not that I'm saying I think the US is currently involved in brokering any diplomacy talks between Ukraine and Russia behind the scenes. But you never really know what's been happening until well after the fact.",True,False,,,,,0,1666974040,,False,0,{},iu4zxjp,False,t3_yfsod4,False,False,,/r/geopolitics/comments/yfsod4/dont_rule_out_diplomacy_in_ukraine_bidens_current/iu4zxjp/,55,False,True,False,geopolitics,t5_2qhnn,r/geopolitics,public,,0,[],,1667869810,1670707200,3b75777c31df234364dd217127697c764563476c,2022-10-28 16:20:40,,1.0,,
[],False,,ShortTermAccount199,1655833681.0,,,[],,,,text,t2_oeqa7xoj,False,False,"What makes this even more complicated is that Azerbaijan is *also* friends with Russia; unlike the partnership with Armenia, the Azeri relationship is bery lucrative (lots of energy trade and they buy Russian weapons too). 

Kremlin probably still sees Armenia as a bit of a PITA-but-mandatory thing to take care of, like they did in the Soviet times. Generally because of the natural resources and better access to the Politburo, the Azerbaijani SSR got all it asked for, such as denying Nagorno-Karabakh's repeated bids to be reunited with Armenian SSR, and in the 80s when things heated up, having the Red Army take *just* a little too long to intervene in local ethnic cleansings. (Well that and also the fact that Stalin saw the fucked up ethnic border as a good poison pill to prevent USSR dissolution) But you also can't just let the Armenians be deprived of a state, so Russia does the minimum.",True,False,,,,,0,1666973490,,True,0,{},iu4ykf5,False,t3_y590s4,False,False,40996838794.0,/r/geopolitics/comments/y590s4/why_doesnt_armenia_simply_give_up_on_russia_and/iu4ykf5/,6,False,True,False,geopolitics,t5_2qhnn,r/geopolitics,public,,0,[],,1667869872,1670707198,6d0f4274a69ffe1a588d8193064e3a80bd345dce,2022-10-28 16:11:30,,,1666973781.0,
[],False,,ShortTermAccount199,1655833681.0,,,[],,,,text,t2_oeqa7xoj,False,False,"TBH UK could maybe have made Brexit work (initially the numbers were somewhat positive), but a lot of the decisions since then have just led to a bit of a vicious cycle. The whole trade war with the EU over the Irish border and fisheries has only hurt the UK economy for literally no (non-vibes-based) gain, and the Tories especially are in a brain drain death spiral because these policies have led to competent people jumping ship. This effect may have peaked with Liz Truss, though; it's *maybe* possible that Sunak will be able to turn the ship around.",True,False,,,,,0,1666972533,,True,0,{},iu4w6m2,False,t3_yem57k,False,False,41003774949.0,/r/geopolitics/comments/yem57k/were_8_months_into_the_ukraine_war_with_recent/iu4w6m2/,3,False,True,False,geopolitics,t5_2qhnn,r/geopolitics,public,,0,[],,1667869982,1670707193,c7bf470e650dabf5aedd1a03bb43c75233669d2d,2022-10-28 15:55:33,,,1666972747.0,
[],False,,ShortTermAccount199,1655833681.0,,,[],,,,text,t2_oeqa7xoj,False,False,"Macron is far from the only person with these big ideas, he's just the one with the most power. But Germany hasn't really bought into them yet. For example, right now there's a quarrel about Germany emphasizing NATO over future EU defense (right now the German acquisition of the F-35 is something France has concerns about), and allegedly Macron fears that Scholz is trying to assemble a coalition with Northern &amp; Eastern member states to counter the French-Mediterranean ""caucus"" in the EU level.

(Historically, on a lot of matters you could divide the EU to 3 ""teams"": pro-responsibility sharing South, led by France; pro-austerity North, led by Germany; and the mostly Eastern pro-America contrarians, sometimes led by UK. So essentially Macron's concern would be that Scholz is getting the pro-America states in his camp by giving up on e.g. some common defense initiatives. Although tbh there's a lot of money involved because any acquisition from outside the EU - such as Polish Abrams and K2, or German F-35 - is a potentiall loss for the French defense industrial complex.)",True,False,,,,,0,1666971608,,True,0,{},iu4tu2x,False,t3_yem57k,False,True,41000617837.0,/r/geopolitics/comments/yem57k/were_8_months_into_the_ukraine_war_with_recent/iu4tu2x/,3,False,True,False,geopolitics,t5_2qhnn,r/geopolitics,public,,0,[],,1667870090,1670707186,d9ca0ba11ead2e9e40e77d92c6fc73a119ab3ddc,2022-10-28 15:40:08,,,1666972008.0,
[],False,,RudionRaskolnikov,,,,[],,,,text,t2_tj2p8rgf,False,False,"Not gonna lie that sounds kinda exhausting to have to tolerate the tantrums of puny nations, but I guess that's the way it is and I being from a bigger country wouldn't understand the smaller pov",True,False,,,,,0,1666971475,,False,0,{},iu4tiai,False,t3_yem57k,False,True,41004135260.0,/r/geopolitics/comments/yem57k/were_8_months_into_the_ukraine_war_with_recent/iu4tiai/,2,False,True,False,geopolitics,t5_2qhnn,r/geopolitics,public,,0,[],,1667870105,1670707185,79f1e116a2941c9f8b724ad64f29425b839f53cb,2022-10-28 15:37:55,,,,
