all_awardings,archived,associated_award,author,author_created_utc,author_flair_background_color,author_flair_css_class,author_flair_richtext,author_flair_template_id,author_flair_text,author_flair_text_color,author_flair_type,author_fullname,author_patreon_flair,author_premium,body,can_gild,collapsed,collapsed_because_crowd_control,collapsed_reason,collapsed_reason_code,comment_type,controversiality,created_utc,distinguished,edited,gilded,gildings,id,is_submitter,link_id,locked,no_follow,parent_id,permalink,score,score_hidden,send_replies,stickied,subreddit,subreddit_id,subreddit_name_prefixed,subreddit_type,top_awarded_type,total_awards_received,treatment_tags,unrepliable_reason,retrieved_utc,updated_utc,body_sha1,utc_datetime_str,author_cakeday,nest_level,edited_on,author_is_blocked
[],False,,Unbannable6905,1664376812.0,,,[],,,,text,t2_swb4ht8v,False,False,Science would tell you to focus on your nation's economy and security instead of weaking yourselves for little reason.,True,False,,,,,0,1666468260,,False,0,{},itdcdjq,False,t3_ya46ss,False,True,40957977134.0,/r/geopolitics/comments/ya46ss/why_isnt_canada_taking_advantage_of_russias/itdcdjq/,1,True,True,False,geopolitics,t5_2qhnn,,public,,0,[],,1666468276,1667421610,0c1b1d4ce4d334a28937a1167dfef8ab6934177d,2022-10-22 19:51:00,,,,False
[],False,,HazardIsFunny,1618722343.0,,,[],,,,text,t2_bly7qago,False,False,Grrrrr sCiEnCe Is BaD,True,False,,,,,0,1666467970,,False,0,{},itdblf2,False,t3_ya46ss,False,True,40957735103.0,/r/geopolitics/comments/ya46ss/why_isnt_canada_taking_advantage_of_russias/itdblf2/,1,True,True,False,geopolitics,t5_2qhnn,,public,,0,[],,1666467981,1667421608,35fa77493e3fb326ad29369c7bad711ccbe1f8aa,2022-10-22 19:46:10,,,,False
[],False,,Unbannable6905,1664376812.0,,,[],,,,text,t2_swb4ht8v,False,False,And it's logistically not better because the liberal government refuses to invest due to environmental bs that they push,True,False,,,,,0,1666465767,,False,0,{},itd6enz,False,t3_ya46ss,False,True,40956516876.0,/r/geopolitics/comments/ya46ss/why_isnt_canada_taking_advantage_of_russias/itd6enz/,1,True,True,False,geopolitics,t5_2qhnn,,public,,0,[],,1666465782,1667421587,98f53db270a8ec00315fabbc8ee11d64cb488d2f,2022-10-22 19:09:27,,,,False
[],False,,Global-Date,1583202697.0,,,[],,,,text,t2_5qhfrdhh,False,False,"This started before the drone thing.

Believe it or not, not everything bad that happens in autocratic repressive regimes is.... The CIAs fault. I",True,False,,,,,0,1666465251,,False,0,{},itd571m,False,t3_y9trhj,False,True,40955014850.0,/r/geopolitics/comments/y9trhj/the_beginning_of_the_end_of_the_islamic_republic/itd571m/,1,True,True,False,geopolitics,t5_2qhnn,,public,,0,[],,1666465269,1667421582,c3e23be3528991df1464d23147fa44c459cb55f8,2022-10-22 19:00:51,,,,False
[],False,,Iggitron90,1373906922.0,,,[],,,,text,t2_cdyeq,False,False,An Iranian activist as well. Totally impartial geopolitical analysis at work.,True,False,,,,,0,1666464878,,False,0,{},itd4bp5,False,t3_y9trhj,False,True,40954743035.0,/r/geopolitics/comments/y9trhj/the_beginning_of_the_end_of_the_islamic_republic/itd4bp5/,1,True,True,False,geopolitics,t5_2qhnn,,public,,0,[],,1666464889,1667421578,820a3f8503a4bc5cbb00aaddb9c7e861fe6bdaa2,2022-10-22 18:54:38,,,,False
[],False,,Global-Date,1583202697.0,,,[],,,,text,t2_5qhfrdhh,False,False,"&gt;&gt;The majority of Iranians despise democracy and are Islamists.

 Everything I read says Iranian people are far more Liberal than similar middle Eastern countries.

And obviously they left for a reason but every single Iranian I have met have deep hatred for the government and say that the sentiment exists at home to a large extent.

I always think if something is within living memory, the nostalgia for it will be strong. And a more Liberal Iran is within living memory.

Do you have resources on Iranian attitudes to share on this?",True,False,,,,,0,1666464831,,False,0,{},itd47v1,False,t3_y9trhj,False,True,40954001912.0,/r/geopolitics/comments/y9trhj/the_beginning_of_the_end_of_the_islamic_republic/itd47v1/,1,True,True,False,geopolitics,t5_2qhnn,,public,,0,[],,1666464843,1667421578,951db8e2ce88cb1c1d841d283a8835fd4d75ce0a,2022-10-22 18:53:51,,,,False
[],False,,cheeselovingviking,1662923232.0,,,[],,,,text,t2_sejcua2v,False,False,"Because Canada decided together with Germany to go another rout and work on hydrogen production and shipment to Europe. 
[hydrogen agreement](https://www.canada.ca/en/natural-resources-canada/news/2022/08/canada-and-germany-sign-agreement-to-enhance-german-energy-security-with-clean-canadian-hydrogen.html)",True,False,,,,,0,1666463895,,False,0,{},itd1zyq,False,t3_ya46ss,False,True,,/r/geopolitics/comments/ya46ss/why_isnt_canada_taking_advantage_of_russias/itd1zyq/,1,True,True,False,geopolitics,t5_2qhnn,,public,,0,[],,1666463907,1667421567,743a90b3233edc5b1b01cb35c8b97142c741361c,2022-10-22 18:38:15,,1.0,,False
[],False,,petapun,1581995887.0,,,[],,,,text,t2_52qfqkbf,False,False,"https://www.buzzsprout.com/1961019/10951034-canadian-gas-is-going-global-an-interview-with-cheniere-energy-and-arc-resources.mp3

ARC Energy Ideas podcast covers topics like this in depth, well worth listening to.",True,False,,,,,0,1666463569,,False,0,{},itd17jr,False,t3_ya46ss,False,True,,/r/geopolitics/comments/ya46ss/why_isnt_canada_taking_advantage_of_russias/itd17jr/,1,True,True,False,geopolitics,t5_2qhnn,,public,,0,[],,1666463584,1667421559,467be79deeb37cc64990259f854ef2b3782c134f,2022-10-22 18:32:49,,1.0,,False
[],False,,petapun,1581995887.0,,,[],,,,text,t2_52qfqkbf,False,False,"I'm just going to assume you're trolling at this point? So I'm going to address anyone else that might be reading this thread...

The hosts of the podcast ARC Energy Ideas are definitely smarter than the average undergrad, and deal with topics like this. Definitely worth a listen.",True,False,,,,,0,1666463443,,False,0,{},itd0woq,False,t3_ya46ss,False,True,40953540849.0,/r/geopolitics/comments/ya46ss/why_isnt_canada_taking_advantage_of_russias/itd0woq/,1,True,True,False,geopolitics,t5_2qhnn,,public,,0,[],,1666463460,1667421558,72334b746cfd5c6e3afdebddcb525c45bfb1455d,2022-10-22 18:30:43,,,,False
[],False,,TripSackNKickBack,1663155886.0,,,[],,,,text,t2_s6l4kcdg,False,False,I’d love to see you to elaborate instead of just stating that it’s BS!,True,False,,,,,0,1666462570,,False,0,{},itcyr1u,False,t3_ya46ss,False,True,40955719577.0,/r/geopolitics/comments/ya46ss/why_isnt_canada_taking_advantage_of_russias/itcyr1u/,1,True,True,False,geopolitics,t5_2qhnn,,public,,0,[],,1666462583,1667421550,f4ff9fa43deabb9eacaef53b5324f22af55ba836,2022-10-22 18:16:10,,,,False
[],False,,AAPgamer0,1653683683.0,,,[],,,,text,t2_n6162we7,False,False,They are very expensive to produce and there isn't the nessary infratuscture for that.,True,False,,,,,0,1666462070,,False,0,{},itcxiaq,False,t3_ya46ss,False,True,,/r/geopolitics/comments/ya46ss/why_isnt_canada_taking_advantage_of_russias/itcxiaq/,1,True,True,False,geopolitics,t5_2qhnn,,public,,0,[],,1666462088,1667421544,68560dc93139484b4c52128bda48665f6292bb50,2022-10-22 18:07:50,,1.0,,False
[],False,,Harmonic_Strategy,1588732434.0,,,[],,,,text,t2_6cpdderd,False,False,NEOM is ... well ... let's not put the cart before the horse. That's all I will say.,True,False,,,,,0,1666461364,,False,0,{},itcvson,False,t3_ya46ss,False,True,40953178042.0,/r/geopolitics/comments/ya46ss/why_isnt_canada_taking_advantage_of_russias/itcvson/,1,True,True,False,geopolitics,t5_2qhnn,,public,,0,[],,1666461379,1667421539,ecbf70f829590edd0b6b9a59b551b0e221341be2,2022-10-22 17:56:04,,,,False
[],False,,NEPXDer,1323809370.0,,,[],,,,text,t2_6flmj,False,False,"It's the most recent article on the subject, I'm not going to hunt for old articles on my phone to satisfy people simply trying to detail discussion.

There have been dozens of similar accusations over the years, if you weren't paying attention to this I can understand but you can now do your own deeper dive.",True,False,,,,,0,1666460264,,False,0,{},itct39r,False,t3_y9trhj,False,True,40955963622.0,/r/geopolitics/comments/y9trhj/the_beginning_of_the_end_of_the_islamic_republic/itct39r/,1,True,True,False,geopolitics,t5_2qhnn,,public,,0,[],,1666460276,1667421532,0b4084f06408a4c45de6946949cb17b334f932a4,2022-10-22 17:37:44,,,,False
[],False,,djauralsects,1352780730.0,,,[],,,,text,t2_9l6rw,False,False,Hydro absolutely does fucking count. It's not the only solution there are other alternatives. Other regions have gone majority renewable without hydro. Renewables that aren't practical in BC would be wildly successful in other regions. We should be putting money into those sources rather than expanding oil and gas.,True,False,,,,,0,1666460128,,False,0,{},itcsrc8,False,t3_ya46ss,False,True,40956974846.0,/r/geopolitics/comments/ya46ss/why_isnt_canada_taking_advantage_of_russias/itcsrc8/,1,True,True,False,geopolitics,t5_2qhnn,,public,,0,[],,1666460143,1667421531,673fdaf6e5e554c19f41dad1870fbc2900ab2b9c,2022-10-22 17:35:28,,,,False
[],False,,djauralsects,1352780730.0,,,[],,,,text,t2_9l6rw,False,False,Every single NDP voter was against expanding oil infrastructure as well. Left of centre candidates won the popular vote and the majority of seats. Try again.,True,False,,,,,0,1666459894,,False,0,{},itcs6dt,False,t3_ya46ss,False,True,40957037543.0,/r/geopolitics/comments/ya46ss/why_isnt_canada_taking_advantage_of_russias/itcs6dt/,1,True,True,False,geopolitics,t5_2qhnn,,public,,0,[],,1666459911,1667421529,c8c6bbe6aec8fc962e3a1756d9263566e7666b00,2022-10-22 17:31:34,,,,False
[],False,,Garet-Jax,1424964356.0,,,[],,,,text,t2_logt6,False,False,"Depends how one views democracy - the Liberals came second in terms of popular vote. 

In terms of popular support the majority of Canadians support

https://globalnews.ca/news/4853116/canada-pipeline-crisis-poll/",True,False,,,,,0,1666459601,,False,0,{},itcrgfb,False,t3_ya46ss,False,True,40956692335.0,/r/geopolitics/comments/ya46ss/why_isnt_canada_taking_advantage_of_russias/itcrgfb/,1,True,True,False,geopolitics,t5_2qhnn,,public,,0,[],,1666459620,1667421527,037fe5f4dc024f38f05568de6caca0dab3b2abab,2022-10-22 17:26:41,,,,False
[],False,,Ziggystz,1406756473.0,,,[],,,,text,t2_hnefk,False,False,Hydro doesn’t count because it can’t be universally applied.,True,False,,,,,0,1666459054,,False,0,{},itcq41q,False,t3_ya46ss,False,True,40956300114.0,/r/geopolitics/comments/ya46ss/why_isnt_canada_taking_advantage_of_russias/itcq41q/,1,True,True,False,geopolitics,t5_2qhnn,,public,,0,[],,1666459071,1667421523,fb1c43449bbc95a6458593610da85cce5deb426e,2022-10-22 17:17:34,,,,False
[],False,,Quetzalcoatle19,1541655678.0,,,[],,,,text,t2_2k64q59i,False,False,"It would not be the logical thing to do because 1: Russia is sabotaging and shutting those pipelines down 2: Were trying to starve Russia economically, anyone buying their products should be sanctioned.",True,False,,,,,0,1666458408,,False,0,{},itcoizo,False,t3_ya46ss,False,True,40953227758.0,/r/geopolitics/comments/ya46ss/why_isnt_canada_taking_advantage_of_russias/itcoizo/,1,True,True,False,geopolitics,t5_2qhnn,,public,,0,[],,1666458424,1667421518,fcc0685b5b7861dbecdbc471849d0f9d489474d9,2022-10-22 17:06:48,,,,False
[],False,,Timely_Jury,1622727720.0,,,[],,,,text,t2_ci5y8txg,False,False,"The Iranian regime has had zero legitimacy since as far back as 2009. What holds it together is a united elite. The regime will fall when mass elite defection occurs. Which is unlikely, as the elite is entirely composed of Islamists who know that the fall of their regime will lead to their extermination. Which is why the regime soldiers on.",True,False,,,,,0,1666458103,,False,0,{},itcns41,False,t3_y9trhj,False,True,,/r/geopolitics/comments/y9trhj/the_beginning_of_the_end_of_the_islamic_republic/itcns41/,1,True,True,False,geopolitics,t5_2qhnn,,public,,0,[],,1666458117,1667421515,20b2333de64c05193b369b9c519717a721f58c64,2022-10-22 17:01:43,,1.0,,False
[],False,,Imbarleyhere,1442821143.0,,,[],,,,text,t2_qmnwh,False,False,"Almost all of Canada oil comes from Alberta province. Now look at all the infrastructure in Canada (rail, road, canals, etc). You’ll notice that Canada has much better infrastructure connections to the USA than it does to its own fellow provinces.  (Short answer as to why that is, permafrost is costly to build on.) So, due to those connections, Canada sells all its oil to the USA who then refines it in Texas who then sells it to the Global markets.",True,False,,,,,0,1666457184,,False,0,{},itcljqe,False,t3_ya46ss,False,True,,/r/geopolitics/comments/ya46ss/why_isnt_canada_taking_advantage_of_russias/itcljqe/,1,True,True,False,geopolitics,t5_2qhnn,,public,,0,[],,1666457195,1667421507,62e4a4b56406866c7b3ac1b60df9e4f45e38df24,2022-10-22 16:46:24,,1.0,,False
[],False,,KombuchaWarfare,1463359233.0,,,[],,,,text,t2_xynmr,False,False,"Because we're not allowed. Oil bad, green good. - PM JT",True,False,,,,,0,1666456781,,False,0,{},itckknj,False,t3_ya46ss,False,True,,/r/geopolitics/comments/ya46ss/why_isnt_canada_taking_advantage_of_russias/itckknj/,1,True,True,False,geopolitics,t5_2qhnn,,public,,0,[],,1666456799,1667421504,d3239f49d054cfdc2029513573526f28aca52df7,2022-10-22 16:39:41,,1.0,,False
[],False,,djauralsects,1352780730.0,,,[],,,,text,t2_9l6rw,False,False,"Yes, and they were democratically elected to do just that.",True,False,,,,,0,1666456563,,False,0,{},itck227,False,t3_ya46ss,False,True,40956660399.0,/r/geopolitics/comments/ya46ss/why_isnt_canada_taking_advantage_of_russias/itck227/,1,True,True,False,geopolitics,t5_2qhnn,,public,,0,[],,1666456577,1667421503,56380e534b69998c589c03518a7807f5370aebc5,2022-10-22 16:36:03,,,,False
[],False,,Garet-Jax,1424964356.0,,,[],,,,text,t2_logt6,False,False,"The current federal government is against building new oil and gas infrastructure.

FTFY",True,False,,,,,0,1666456277,,False,0,{},itcjdf3,False,t3_ya46ss,False,True,40952782757.0,/r/geopolitics/comments/ya46ss/why_isnt_canada_taking_advantage_of_russias/itcjdf3/,1,True,True,False,geopolitics,t5_2qhnn,,public,,0,[],,1666456296,1667421500,92bfb5dcffe7122748cfcfa81eeaf029c54693b8,2022-10-22 16:31:17,,,,False
[],False,,[deleted],,,,,,,dark,,,,,[removed],True,True,,,DELETED,,0,1666456076,,False,0,{},itciw6a,False,t3_ya46ss,False,True,40956551631.0,/r/geopolitics/comments/ya46ss/why_isnt_canada_taking_advantage_of_russias/itciw6a/,1,True,True,False,geopolitics,t5_2qhnn,,public,,0,[],,1666456093,1667421499,fe993932d6dced4c0a879e9aa5d7a6e0fbb467f5,2022-10-22 16:27:56,,,,False
[],False,,djauralsects,1352780730.0,,,[],,,,text,t2_9l6rw,False,False,"You do you. Alberta is a shithole. Climate  geography, politics and the people are all non-starters for. Where I live gives me the opportunity to live how I want to live. No amount of money could make me live in Alberta. I know this may be hard to understand for someone like you put some of us aren't motivated by materialism.",True,False,,,,,0,1666455291,,False,0,{},itch1hr,False,t3_ya46ss,False,True,40956482592.0,/r/geopolitics/comments/ya46ss/why_isnt_canada_taking_advantage_of_russias/itch1hr/,1,True,True,False,geopolitics,t5_2qhnn,,public,,0,[],,1666455305,1667421492,fb62437e50afca43a40db55fd477e64a148270b6,2022-10-22 16:14:51,,,,False
[],False,,Halcyon3k,1378838869.0,,,[],,,,text,t2_d3gkk,False,False,"Again, I’m talking about energy use, not electricity use.  They are not equivalent.

Also, methane released from hydro projects is not negligible, especially considering methane’s potency as a ghg compared to CO2.",True,False,,,,,0,1666455165,,False,0,{},itcgqj8,False,t3_ya46ss,False,True,40956488474.0,/r/geopolitics/comments/ya46ss/why_isnt_canada_taking_advantage_of_russias/itcgqj8/,1,True,True,False,geopolitics,t5_2qhnn,,public,,0,[],,1666455178,1667421491,499c6f8f55ebee0cdc8a41870d1edf69e13a07ae,2022-10-22 16:12:45,,,,False
[],False,,dumazzbish,1508378849.0,,,[],,,,text,t2_hu6o0t9,False,False,Canada is in the top ten largest petroleum &amp; lng exporters in the world. it's closer to 5 than 10 for both. i would encourage you to diversify your news sources. the reasons it's not a bigger exporter are all logistical not environment.,True,False,,,,,0,1666454978,,False,0,{},itcgaoc,False,t3_ya46ss,False,False,40955863188.0,/r/geopolitics/comments/ya46ss/why_isnt_canada_taking_advantage_of_russias/itcgaoc/,1,True,True,False,geopolitics,t5_2qhnn,,public,,0,[],,1666454992,1667421490,b8ae6ccc267bde6cc46e126aa4baa3962243513b,2022-10-22 16:09:38,,,,False
[],False,,dumazzbish,1508378849.0,,,[],,,,text,t2_hu6o0t9,False,False,"yeah it's a combined to a whopping 18% vs nuclear's 15%. if you want to combine fossil fuels, you should combine non-fossil fuels too which is an ~80/20 split. like i said, it's likely a state by state issue and Ontario (largest province) is committed to continued use of nuclear and training the expertise required to operate it and it seems like other provinces are committing to it as well. 

hydro has a huge environmental impact but the carbon emissions are comparatively negligible. I'm not sure if u have ever met a real person advocating for cutting ghg's or if ur only exposure to them is stereotypes but most ppl accept the nebulous but contained environmental impact of increased hydro capacity especially when the alternative is much worse. believe it or not people u disagree with are capable of rational thought.",True,False,,,,,0,1666454718,,False,0,{},itcfore,False,t3_ya46ss,False,True,40956305211.0,/r/geopolitics/comments/ya46ss/why_isnt_canada_taking_advantage_of_russias/itcfore/,1,True,True,False,geopolitics,t5_2qhnn,,public,,0,[],,1666454733,1667421488,a807001c0e657abd5dda635ea32deafef588dc03,2022-10-22 16:05:18,,,,False
[],False,,upsettinglybigoops,1659158549.0,,,[],,,,text,t2_qnwgdvw8,False,False,"Some Canadians have no choice, because paying $2000-$3000 rent in Toronto or Vancouver is undoable and Alberta is miles better then other cheaper provinces like Manitoba, or Saskatchewan.

I plan on working in Alberta once I get my red seal, it would be stupid not to. $45 buck an hour 12 hour shifts and overtime up the wazoo. 3 weeks on, 3 weeks off. Do the math. I get a shitton of $ and I get more time off then anybody I know.",True,False,,,,,0,1666454663,,False,0,{},itcfk80,False,t3_ya46ss,False,True,40956418961.0,/r/geopolitics/comments/ya46ss/why_isnt_canada_taking_advantage_of_russias/itcfk80/,1,True,True,False,geopolitics,t5_2qhnn,,public,,0,[],,1666454678,1667421486,b493388e6d43c9d60cbe7381ab565b86215c1284,2022-10-22 16:04:23,,,,False
[],False,,Arshhh18,1664548268.0,,,[],,,,text,t2_stdc2eq9,False,False,Because US won't allow Canada.,True,False,,,,,0,1666454614,,False,0,{},itcfg3p,False,t3_ya46ss,False,True,,/r/geopolitics/comments/ya46ss/why_isnt_canada_taking_advantage_of_russias/itcfg3p/,1,True,True,False,geopolitics,t5_2qhnn,,public,,0,[],,1666454631,1667421486,9828ca43a7418ea022b5a5221b8b4fab21270ef7,2022-10-22 16:03:34,,1.0,,False
[],False,,Halcyon3k,1378838869.0,,,[],,,,text,t2_d3gkk,False,False,"Absolutely, Churchill is a prime place where we should be developing and building up infrastructure.  Canada prides itself on its arctic but it’s gone largely forgotten from a geostrategic point of view.  The rail line up there alone is in terrible shape which would be a precursor to large scale development up there that the local population desperately needs.",True,False,,,,,0,1666454372,,False,0,{},itcevad,False,t3_ya46ss,False,True,40956321461.0,/r/geopolitics/comments/ya46ss/why_isnt_canada_taking_advantage_of_russias/itcevad/,1,True,True,False,geopolitics,t5_2qhnn,,public,,0,[],,1666454385,1667421484,3f40c378e846573c5af23084f89235ffc689f3a2,2022-10-22 15:59:32,,,,False
[],False,,djauralsects,1352780730.0,,,[],,,,text,t2_9l6rw,False,False,There's a lot more to life than the economy. You couldn't pay me to live in Alberta. You should go.,True,False,,,,,0,1666454085,,False,0,{},itce74h,False,t3_ya46ss,False,True,40956409641.0,/r/geopolitics/comments/ya46ss/why_isnt_canada_taking_advantage_of_russias/itce74h/,1,True,True,False,geopolitics,t5_2qhnn,,public,,0,[],,1666454104,1667421482,4d13054602b46530ba436a9f67a3c72f5079efcb,2022-10-22 15:54:45,,,,False
[],False,,upsettinglybigoops,1659158549.0,,,[],,,,text,t2_qnwgdvw8,False,False,"I'm from BC. Thats funny you ask that as if it was an insult. Alberta is the most affordable part of Canada, best paying jobs, and has the best provincial economy in Canada.",True,False,,,,,0,1666454000,,False,0,{},itcdzxl,False,t3_ya46ss,False,True,40956308636.0,/r/geopolitics/comments/ya46ss/why_isnt_canada_taking_advantage_of_russias/itcdzxl/,1,True,True,False,geopolitics,t5_2qhnn,,public,,0,[],,1666454018,1667421480,e5fdad24366ecc5be918f5d96e916da04d4f2b5c,2022-10-22 15:53:20,,,,False
[],False,,Darth_K-oz,1639696267.0,,,[],,,,text,t2_50iqkcqh,False,False,"I’m actually going to take it in a different direction from pipelines and get more theoretical.  

There are barely any pipelines that pass through the Appalachian mountain because of the U.S. and the Louisiana purchase and setting up great economic opportunities that started with farming. While we can now bore and blast through rock, it’s still cheaper to find flat land and go through large population hubs where shipping routes are already located and distribution hubs are located.

Now a quick search has showed oil tankers are safer than pipeline or rail and with the arctic shelf melting, we shouldn’t be worried about pipelines but creating efficient transportation networks through the Hudson Bay and Arctic, potentially through Churchill. The pipelines would follow be far cheaper and barges could be made that are far larger than those that would need to pass through the Panama Canal. Furthermore with better infrastructure this wouldn’t only impact shipping oils and natural gas but other products as well and it wouldn’t require one company to invest in a large pipeline but include multiple shipping companies to produce ships in different labour markets simultaneously.

The distance for a pipeline to Churchill, Manitoba would be 1,300 km to Edmonton compared to 4,800 km going for Edmonton to Halifax, Nova Scotia. This isn’t considering current pipeline infrastructure.

Anyway, appreciate the discussion.

The only other issue going that way is the amount of lakes and marsh that you’d have to pass through which would be similar to putting a pipeline through Norther Ontario",True,False,,,,,0,1666453196,,False,0,{},itcc3w5,False,t3_ya46ss,False,True,40956126169.0,/r/geopolitics/comments/ya46ss/why_isnt_canada_taking_advantage_of_russias/itcc3w5/,1,True,True,False,geopolitics,t5_2qhnn,,public,,0,[],,1666453212,1667421467,720c755d7f21c5f35ddc8ff38f0f0967f2c72e75,2022-10-22 15:39:56,,,,False
[],False,,headshotscott,1502677022.0,,,[],,,,text,t2_afl4bhy,False,False,"Nope it hasn't done any of the smart things the Japanese have done to address its demographic crisis. It's not Japan, but would be much better off if it were.",True,False,,,,,0,1666453180,,False,0,{},itcc2ma,False,t3_xy6b4b,False,True,40875454275.0,/r/geopolitics/comments/xy6b4b/biden_administration_clamps_down_on_chinas_access/itcc2ma/,1,True,True,False,geopolitics,t5_2qhnn,,public,,0,[],,1666453195,1667421467,8e3a044b90878cd92d730799ee1fc0eb386c9bd0,2022-10-22 15:39:40,,,,False
[],False,,headshotscott,1502677022.0,,,[],,,,text,t2_afl4bhy,False,False,"The idea that China is ""taking over"" is, to be charitable, silly. They are in steep demographic decline and have a financial system that's barely keeping itself together today - at the best of times. They have utterly and hopelessly botched their Covid vaccination protocols- twice - and are still using lockdown as their primary defense. It's going to be 2024 or probably 2025 before they can hope to get a handle on it.

They may eventually have the largest economy in the world, but that's not taking over anything.

They are also in a box where, in any real conflict, the west could crush their economy and more or less strangle a great deal of their energy inputs. They 

They're always going to be a manufacturing power, but the NAFTA corridor can match them. And that's with America mostly not really doing much to try to bring manufacturing back. Add in any manufacturing policy suite of substance and it changes rapidly.

Taking over is not something they can do.",True,False,,,,,0,1666453097,,False,0,{},itcbvqf,False,t3_xy6b4b,False,True,40842178177.0,/r/geopolitics/comments/xy6b4b/biden_administration_clamps_down_on_chinas_access/itcbvqf/,1,True,True,False,geopolitics,t5_2qhnn,,public,,0,[],,1666453110,1667421466,9c822539b1ba644b49b6102f3c359e43fd2b02eb,2022-10-22 15:38:17,,,,False
[],False,,NorthLegend517,1397516679.0,,,[],,,,text,t2_g4noq,False,False,"Also, if you build the necessary infrastructure, it’ll cost billions and countries all over Europe are making climate targets in the next 5-10 years, so what is it worth to build such a large inversement on the east coast if the Europeans don’t want your product in the medium term?",True,False,,,,,0,1666453087,,False,0,{},itcbuxj,False,t3_ya46ss,False,True,40952322930.0,/r/geopolitics/comments/ya46ss/why_isnt_canada_taking_advantage_of_russias/itcbuxj/,1,True,True,False,geopolitics,t5_2qhnn,,public,,0,[],,1666453101,1667421466,643f9482823f1405f7822ba479ebf39e4c47b3c2,2022-10-22 15:38:07,,,,False
[],False,,djauralsects,1352780730.0,,,[],,,,text,t2_9l6rw,False,False,What part of Alberta are you from?,True,False,,,,,0,1666453076,,False,0,{},itcbtzw,False,t3_ya46ss,False,True,40955706879.0,/r/geopolitics/comments/ya46ss/why_isnt_canada_taking_advantage_of_russias/itcbtzw/,1,True,True,False,geopolitics,t5_2qhnn,,public,,0,[],,1666453093,1667421466,a85c540cb4c7211bbd9bbe64ad8d9d0d27bb6348,2022-10-22 15:37:56,,,,False
