all_awardings,archived,associated_award,author,author_created_utc,author_flair_background_color,author_flair_css_class,author_flair_richtext,author_flair_template_id,author_flair_text,author_flair_text_color,author_flair_type,author_fullname,author_patreon_flair,author_premium,body,can_gild,collapsed,collapsed_because_crowd_control,collapsed_reason,collapsed_reason_code,comment_type,controversiality,created_utc,distinguished,edited,gilded,gildings,id,is_submitter,link_id,locked,no_follow,parent_id,permalink,score,score_hidden,send_replies,stickied,subreddit,subreddit_id,subreddit_name_prefixed,subreddit_type,top_awarded_type,total_awards_received,treatment_tags,unrepliable_reason,retrieved_utc,updated_utc,body_sha1,utc_datetime_str,author_cakeday,nest_level,edited_on,author_is_blocked
[],False,,DagnirGlaurung,1660923981.0,,,[],,,,text,t2_rolktaxy,False,False,"Not even that - it’s a mission statement with an annual conference. The only thing in common all SCO countries have in common is disaffection with Western “dominance”, which I put in air quotes because the West never controlled China, Russia, or the Stans. Nevertheless, all of them were disaffected with the state of the world in the 2000s, with each of them feeling besieged - Russia faced American allies to the West, India to the North (Pakistan and Afghanistan) and China to the East. While based in Shanghai, the organization is actually spearheaded by Russia, which uses it as a forum to resolve issues between its only two major allies.",True,False,,,,,1,1666890740,,False,0,{},iu0g5l0,False,t3_ye1l1v,False,True,40989200668.0,/r/geopolitics/comments/ye1l1v/the_sco_and_the_shape_of_the_conflict_to_come_the/iu0g5l0/,-1,False,True,False,geopolitics,t5_2qhnn,r/geopolitics,public,,0,[],,1667877395,1670706812,9f308d4e38b2001ba345b8dd07023a9c6d584ec9,2022-10-27 17:12:20,,,,
[],False,,audigex,1364382830.0,,,[],,,,text,t2_b3cs6,False,True,"That's a very specific niche situation, though, and I don't see why that would make Pakistan anti-NATO before such a request happened (if, indeed, it happened at all), just based on a possibility that one day it does",True,False,,,,,0,1666887611,,False,0,{},iu082eb,False,t3_ye1l1v,False,False,40996336260.0,/r/geopolitics/comments/ye1l1v/the_sco_and_the_shape_of_the_conflict_to_come_the/iu082eb/,5,False,True,False,geopolitics,t5_2qhnn,r/geopolitics,public,,0,[],,1667877773,1670706796,c39c1c65542a2861ad21cac1ec55c26eb8a78775,2022-10-27 16:20:11,,,,
[],False,,humblenyrok,1388994259.0,,,[],,,,text,t2_eodee,False,False,"Pakistan I could see having some reason to dislike NATO aligned countries due to the strategic position of Pakistan between China and MENA Oil supply routes. If a conventional conflict were to occur between the US and China, Pakistan would definitely feel pressure from the US to close its overland routes, without much in the way of compensation. At which point they may very well choose to side with China. But as of right now I see them more being on the fence, with their economic ties to China snd their military ties to the US.",True,False,,,,,0,1666886717,,False,0,{},iu05ric,False,t3_ye1l1v,False,False,40992851855.0,/r/geopolitics/comments/ye1l1v/the_sco_and_the_shape_of_the_conflict_to_come_the/iu05ric/,1,False,True,False,geopolitics,t5_2qhnn,r/geopolitics,public,,0,[],,1667877882,1670706791,b63123d0d5897a570208a1bb13e46d9f4f321d43,2022-10-27 16:05:17,,,,
[],False,,theatlantic,,,,[],,,,text,t2_15htj3oj,False,False,"&gt;Barbados, the easternmost stretch of land in the Caribbean Sea, is a pear-shaped island surrounded by a dense network of bright coral. As you crisscross the island, gently sloped hills give way to mazes of sugarcane fields. The plantations that once controlled the sugar crop were some of the first outposts of British colonial control in all of the Americas. That history, dating back to when an English ship arrived in 1625, is not as distant as it may seem. Though Barbados gained its independence as a constitutional monarchy in 1966, only last year did the nation formally sever ties with Britain—removing Queen Elizabeth II as its head of state and electing the nation’s first president in the process.  
&gt;  
&gt;As in any postcolonial place, the complexities of the past occupation are omnipresent if not entirely tangible. The stakes of shedding colonial ties are under the surface of nearly every debate in public and political life. That’s true in nations across the Caribbean, as well as former U.S. territories such as Hawaii. Still, Barbados is unusual even among nations once colonized by the British. I came to the island because I wanted to understand what had made it possible for the country previously nicknamed “Little England” to distance itself from the monarchy, and what that distance actually means. What I found was a rare and deliberate expression of public memory that is reshaping the way Barbadians understand their place in the world.

**Read more:** https://www.theatlantic.com/international/archive/2022/10/barbados-independence-movement-britain-colony-history/671884/",True,False,,,,,0,1666884289,,False,0,{},itzzjxq,True,t3_yeusv7,False,True,,/r/geopolitics/comments/yeusv7/the_worlds_newest_republic_barbados_sovereignty/itzzjxq/,1,False,True,False,geopolitics,t5_2qhnn,r/geopolitics,public,,0,[],,1667878173,1670706778,db3ab8957fe296e43f9ba11af4968b074ec2cf9c,2022-10-27 15:24:49,,1.0,,
[],False,,redandwhitebear,1568862327.0,,,[],,,,text,t2_4ma69wm9,False,False,Indonesia hasn’t been an Islamic theocracy for almost 80 years.,True,False,,,,,0,1666884099,,False,0,{},itzz2ed,False,t3_y9trhj,False,False,40988316294.0,/r/geopolitics/comments/y9trhj/the_beginning_of_the_end_of_the_islamic_republic/itzz2ed/,14,False,True,False,geopolitics,t5_2qhnn,r/geopolitics,public,,0,[],,1667878195,1670706777,b077e2d31a622a79b4d5d021959003e9df98e2e3,2022-10-27 15:21:39,,,,
[],False,,[deleted],,,,,,,dark,,,,,[removed],True,True,,,DELETED,,0,1666879252,,False,0,{},itzn24k,False,t3_ye1l1v,False,True,,/r/geopolitics/comments/ye1l1v/the_sco_and_the_shape_of_the_conflict_to_come_the/itzn24k/,1,False,True,False,geopolitics,t5_2qhnn,r/geopolitics,public,,0,[],,1667878759,1670706749,fe993932d6dced4c0a879e9aa5d7a6e0fbb467f5,2022-10-27 14:00:52,,1.0,,
[],False,,Owaiskalyar,1606936007.0,,,[],,,,text,t2_86ple3ep,False,False,"True, Giant companies have become so giant that their operations and decisions can impact government strategic and operational activities. However, as far as the US government and technology companies nexus is concerned, any US company cannot go to such an extent without being noded by the US establishment. These giant techs, though work independently, have a convergence of interests with the US govt somehow. The US government provides them with legal and popular protection and they work to grab financial troves. In war areas, Starlink cannot operate without being protected by the US military in space, as a company can never bet its assets against a country- Russia- due to numerous factors such as not having a force to counteract the rival and all know that. 
Having said that, you are right, the US government is going to harness the power of cutting-edge giants in its policy execution the way it has been doing for many years. Jasmine revolution, Racism, Islamophobia, Green revolution, and cyber-attacks all have been done through private companies - for example Facebook.",True,False,,,,,0,1666863874,,False,0,{},itywiue,False,t3_y9b7hi,False,True,40943328980.0,/r/geopolitics/comments/y9b7hi/big_tech_goes_to_war_to_help_ukraine_washington/itywiue/,1,False,True,False,geopolitics,t5_2qhnn,r/geopolitics,public,,0,[],,1667879984,1670706697,37c931222c5b1ec90cad8c3d09bad067d22899a6,2022-10-27 09:44:34,,,,
[],False,,Owaiskalyar,1606936007.0,,,[],,,,text,t2_86ple3ep,False,False,"True, Giant companies have become so giant that their operations and decisions can impact government strategic and operational activities. However, as far as the US government and technology companies nexus is concerned, any US company cannot go to such an extent without being noded by the US establishment. These giant techs, though work independently, have a convergence of interests with the US govt somehow. The US government provides them with legal and popular protection and they work to grab financial troves. In war areas, Starlink cannot operate without being protected by the US military in space, as a company can never bet its assets against a country- Russia- due to numerous factors such as not having a force to counteract the rival and all know that. 
Having said that, you are right, the US government is going to harness the power of cutting-edge giants in its policy execution the way it has been doing for many years. Jasmine revolution, Racism, Islamophobia, Green revolution, and cyber-attacks all have been done through private companies - for example Facebook.",True,False,,,,,0,1666863863,,False,0,{},itywie0,False,t3_y9b7hi,False,True,40943328980.0,/r/geopolitics/comments/y9b7hi/big_tech_goes_to_war_to_help_ukraine_washington/itywie0/,1,False,True,False,geopolitics,t5_2qhnn,r/geopolitics,public,,0,[],,1667879985,1670706697,37c931222c5b1ec90cad8c3d09bad067d22899a6,2022-10-27 09:44:23,,,,
[],False,,Owaiskalyar,1606936007.0,,,[],,,,text,t2_86ple3ep,False,False,"True, Giant companies have become so giant that their operations and decisions can impact government strategic and operational activities. However, as far as the US government and technology companies nexus is concerned, any US company cannot go to such an extent without being noded by the US establishment. These giant techs, though work independently, have a convergence of interests with the US govt somehow. The US government provides them with legal and popular protection and they work to grab financial troves. In war areas, Starlink cannot operate without being protected by the US military in space, as a company can never bet its assets against a country- Russia- due to numerous factors such as not having a force to counteract the rival and all know that. 
Having said that, you are right, the US government is going to harness the power of cutting-edge giants in its policy execution the way it has been doing for many years. Jasmine revolution, Racism, Islamophobia, Green revolution, and cyber-attacks all have been done through private companies - for example Facebook.",True,False,,,,,0,1666863837,,False,0,{},itywh8s,False,t3_y9b7hi,False,True,40943328980.0,/r/geopolitics/comments/y9b7hi/big_tech_goes_to_war_to_help_ukraine_washington/itywh8s/,1,False,True,False,geopolitics,t5_2qhnn,r/geopolitics,public,,0,[],,1667879986,1670706697,37c931222c5b1ec90cad8c3d09bad067d22899a6,2022-10-27 09:43:57,,,,
[],False,,Owaiskalyar,1606936007.0,,,[],,,,text,t2_86ple3ep,False,False,"True, Giant companies have become so giant that their operations and decisions can impact government strategic and operational activities. However, as far as the US government and technology companies nexus is concerned, any US company cannot go to such an extent without being noded by the US establishment. These giant techs, though work independently, have a convergence of interests with the US govt somehow. The US government provides them with legal and popular protection and they work to grab financial troves. In war areas, Starlink cannot operate without being protected by the US military in space, as a company can never bet its assets against a country- Russia- due to numerous factors such as not having a force to counteract the rival and all know that. 
Having said that, you are right, the US government is going to harness the power of cutting-edge giants in its policy execution the way it has been doing for many years. Jasmine revolution, Racism, Islamophobia, Green revolution, and cyber-attacks all have been done through private companies - for example Facebook.",True,False,,,,,0,1666863785,,False,0,{},itywf1w,False,t3_y9b7hi,False,False,40943328980.0,/r/geopolitics/comments/y9b7hi/big_tech_goes_to_war_to_help_ukraine_washington/itywf1w/,2,False,True,False,geopolitics,t5_2qhnn,r/geopolitics,public,,0,[],,1667879989,1670706697,37c931222c5b1ec90cad8c3d09bad067d22899a6,2022-10-27 09:43:05,,,,
[],False,,Spiderman3039,1524730897.0,,,[],,,,text,t2_199iy540,False,False,Bot,True,False,,,,,0,1666857217,,False,0,{},ityouw3,False,t3_jrx85j,False,False,35547810731.0,/r/geopolitics/comments/jrx85j/is_zeihan_just_wrong/ityouw3/,1,False,True,False,geopolitics,t5_2qhnn,r/geopolitics,public,,0,[],,1667880335,1670706681,3a3192e2791c5786180d02264b5e9345405afa7d,2022-10-27 07:53:37,,,,
[],False,,Heavy-Ad6366,,,,[],,,,text,t2_8jxmqg3e,False,True,The B61-12 has consolidated three earlier versions of the B61 bomb to develop into a more accurate weapon offering explosive yields up to 50 kilotons.,True,False,,,,,0,1666854448,,False,0,{},ityllc0,True,t3_yel4io,False,True,,/r/geopolitics/comments/yel4io/amid_rising_nuclear_tensions_us_to_replace_older/ityllc0/,1,False,True,False,geopolitics,t5_2qhnn,r/geopolitics,public,,0,[],,1667880484,1670706673,0ab79210fccce73b19bab11ac86be572124236f4,2022-10-27 07:07:28,,1.0,,
[],False,,[deleted],,,,,,,dark,,,,,[removed],True,True,,,DELETED,,0,1666853489,,False,0,{},itykfj5,False,t3_ye1l1v,False,True,40993335683.0,/r/geopolitics/comments/ye1l1v/the_sco_and_the_shape_of_the_conflict_to_come_the/itykfj5/,1,False,True,False,geopolitics,t5_2qhnn,r/geopolitics,public,,0,[],,1667880537,1670706672,fe993932d6dced4c0a879e9aa5d7a6e0fbb467f5,2022-10-27 06:51:29,,,,
[],False,,Iancreed,1577053987.0,,,[],,,,text,t2_5a4yan4a,False,False,India wouldn’t join any anti nato organization. They trade heavily with nato member states.,True,False,,,,,0,1666848192,,False,0,{},itydg8z,False,t3_ye1l1v,False,False,,/r/geopolitics/comments/ye1l1v/the_sco_and_the_shape_of_the_conflict_to_come_the/itydg8z/,17,False,True,False,geopolitics,t5_2qhnn,r/geopolitics,public,,0,[],,1667880853,1670706657,557b500301608f2e22d8311337b9b9aeac0217ca,2022-10-27 05:23:12,,1.0,,
[],False,,dumazzbish,1508378849.0,,,[],,,,text,t2_hu6o0t9,False,False,"the liberals and their climate plan is widely called out as being a joke by every climate organization, they're constantly accused of being quintessential green washers. you should read a diversity of news sources, Justin Trudeau is more of a centrist than a progressive. 

can you tell me what plans they've opposed for limiting emissions. i know they bought one pipeline and had the same stance on keystone as Donald Trump who is as pro-oil as it gets.",True,False,,,,,0,1666846650,,False,0,{},ityb6ok,False,t3_ya46ss,False,True,40992886332.0,/r/geopolitics/comments/ya46ss/why_isnt_canada_taking_advantage_of_russias/ityb6ok/,1,False,True,False,geopolitics,t5_2qhnn,r/geopolitics,public,,0,[],,1667880957,1670706655,6ccf77d835da8e83117ca1a46042765dd154b7f8,2022-10-27 04:57:30,,,,
[],False,,dumazzbish,1508378849.0,,,[],,,,text,t2_hu6o0t9,False,False,"this kind of infrastructure takes years to complete if you ignore every law on the books (consultation, rehoming, environment, buying land, etc) and otherwise decades. Nordstream II took ten years to build. the profitablity of selling to Europe is only as long as the war goes on. building infrastructure assuming the war in Ukraine will last ten years is not feasible. Europe cannot afford the current American prices and will not be able to weather it long term. a weaker Europe is also not in Canada's interest.",True,True,,,,,0,1666846405,,False,0,{},ityat77,False,t3_ya46ss,False,True,40992903850.0,/r/geopolitics/comments/ya46ss/why_isnt_canada_taking_advantage_of_russias/ityat77/,1,False,True,False,geopolitics,t5_2qhnn,r/geopolitics,public,,0,[],,1667880975,1670706654,6bfb82c8e1eb6efa494ece7bfe46be2564b6d43a,2022-10-27 04:53:25,,,,
[],False,,Simsters,1492991134.0,,,[],,,,text,t2_17cki4,False,False,"As a Canadian who watches the House of Commons procedures, the Conservative Party of Canada under their new leader Pierre Poilievre have been clear that Canada should invest in becoming an energy exporter such as through LNG (liquified natural gas) projects. The ruling Liberal Party of Canada under Prime Minister Justin Trudeau cite climate change as the reason for purposely blocking these projects from taking fruition. The liberals are also set on tripling the carbon tax in Canada. As much as logistics and start up costs for laying pipework is a factor, Liberals are purposely, proudly, and effectively limiting energy projects so that is certainly a factor as well.",True,False,,,,,0,1666842607,,False,0,{},ity4kd5,False,t3_ya46ss,False,True,,/r/geopolitics/comments/ya46ss/why_isnt_canada_taking_advantage_of_russias/ity4kd5/,3,False,True,False,geopolitics,t5_2qhnn,r/geopolitics,public,,0,[],,1667881261,1670706646,a0010ba6688c7b48592cad3e0b2d2c1b5518a99f,2022-10-27 03:50:07,,1.0,,
[],False,,Simsters,1492991134.0,,,[],,,,text,t2_17cki4,False,False,those are good points but there wasn't an energy crisis in Europe during Harper's reign. It might be more profitable now,True,False,,,,,0,1666842403,,False,0,{},ity471m,False,t3_ya46ss,False,True,40958672583.0,/r/geopolitics/comments/ya46ss/why_isnt_canada_taking_advantage_of_russias/ity471m/,1,False,True,False,geopolitics,t5_2qhnn,r/geopolitics,public,,0,[],,1667881279,1670706645,5c5680e274cec4d30faa48c0adab7f79ab819578,2022-10-27 03:46:43,,,,
[],False,,Simsters,1492991134.0,,,[],,,,text,t2_17cki4,False,False,"The Liberals proudly cite climate change in the House of Commons to defend blocking and limiting energy projects and their carbon taxes. This is not coming from ""special conservative news sources"". Pierre Poilievre, the new Conservative leader has been constantly calling them out on it.",True,False,,,,,0,1666842195,,False,0,{},ity3tj0,False,t3_ya46ss,False,False,40956516876.0,/r/geopolitics/comments/ya46ss/why_isnt_canada_taking_advantage_of_russias/ity3tj0/,1,False,True,False,geopolitics,t5_2qhnn,r/geopolitics,public,,0,[],,1667881295,1670706645,90248f618f1003a9ef054a559831e118af068895,2022-10-27 03:43:15,,,,
[],False,,audigex,1364382830.0,,,[],,,,text,t2_b3cs6,False,True,"“Currently” is doing a lot of heavy lifting in that sentence IMO

Pakistan/India, China/India, and other tensions between the major economies/powers in the SCO are not going away anytime soon, if ever. I don’t think there’s any “currently” about it

But I also don’t see Pakistan or India wanting to be anti-NATO anyway. What do they have to dislike about NATO, really?",True,False,,,,,0,1666841792,,False,0,{},ity32xb,False,t3_ye1l1v,False,False,40988264806.0,/r/geopolitics/comments/ye1l1v/the_sco_and_the_shape_of_the_conflict_to_come_the/ity32xb/,18,False,True,False,geopolitics,t5_2qhnn,r/geopolitics,public,,0,[],,1667881329,1670706645,f33daf07e9930d2baae286cd8d64ca6553ee0ea4,2022-10-27 03:36:32,,,,
[],False,,enjoyingbread,1305080048.0,,,[],,,,text,t2_57wxc,False,False,"Armenia is being treated like Kurdistan. 

Scary to think of a world where Armenia's land is picked apart by it's neighbors, but it could happen.",True,False,,,,,0,1666839614,,False,0,{},itxz0f5,False,t3_y590s4,False,False,40968699258.0,/r/geopolitics/comments/y590s4/why_doesnt_armenia_simply_give_up_on_russia_and/itxz0f5/,11,False,True,False,geopolitics,t5_2qhnn,r/geopolitics,public,,0,[],,1667881515,1670706636,91cc05d37e2461e86d4e14b51b7e10cfe412f071,2022-10-27 03:00:14,,,,
[],False,,[deleted],,,,,,,dark,,,,,[removed],True,True,,,DELETED,,0,1666837941,,True,0,{},itxvmyi,False,t3_ybz7ol,False,True,40991723410.0,/r/geopolitics/comments/ybz7ol/what_the_philippines_has_at_stake_in_taiwan/itxvmyi/,7,False,True,False,geopolitics,t5_2qhnn,r/geopolitics,public,,0,[],,1667881671,1670706629,fe993932d6dced4c0a879e9aa5d7a6e0fbb467f5,2022-10-27 02:32:21,,,1666838144.0,
[],False,,[deleted],,,,,,,dark,,,,,[removed],True,True,,,DELETED,,0,1666837850,,False,0,{},itxvg4g,False,t3_ye1l1v,False,True,,/r/geopolitics/comments/ye1l1v/the_sco_and_the_shape_of_the_conflict_to_come_the/itxvg4g/,1,False,True,False,geopolitics,t5_2qhnn,r/geopolitics,public,,0,[],,1667881679,1670706629,fe993932d6dced4c0a879e9aa5d7a6e0fbb467f5,2022-10-27 02:30:50,,1.0,,
[],False,,[deleted],,,,,,,dark,,,,,[deleted],True,True,,,DELETED,,0,1666831663,,False,0,{},itxi1mp,False,t3_ye1l1v,False,True,,/r/geopolitics/comments/ye1l1v/the_sco_and_the_shape_of_the_conflict_to_come_the/itxi1mp/,1,False,True,False,geopolitics,t5_2qhnn,r/geopolitics,public,,0,[],,1667882298,1670706601,228f7d207920fb84335fac5b2b06ed7b472ece9e,2022-10-27 00:47:43,,1.0,,
[],False,,schtean,1588428673.0,,,[],,,,text,t2_532t6j7o,False,False,"With Japan for example, you are saying the PRC would allow a large build up of US troops and equipment in Japan without the US first using Japanese bases directly to attack PRC forces? 

I'm not so sure, in a war situation they would probably do something preemptive to stop a large buildup. The PRC already fired missiles into Japanese waters when they did exercises around Taiwan. 

Similarly with the Philippines, the US would do some kind of buildup before actually using the bases. If they were already at war with the US, I think it would make more sense attack before the buildup.",True,False,,,,,1,1666830243,,False,0,{},itxew7m,False,t3_ybz7ol,False,True,40988502574.0,/r/geopolitics/comments/ybz7ol/what_the_philippines_has_at_stake_in_taiwan/itxew7m/,-1,False,True,False,geopolitics,t5_2qhnn,r/geopolitics,public,,0,[],,1667882445,1670706595,614721cc421f1f20b6aeaf30c67028b37db92914,2022-10-27 00:24:03,,,,
[],False,,[deleted],,,,,,,dark,,,,,[removed],True,True,,,DELETED,,0,1666829247,,False,0,{},itxcmyn,False,t3_ye1l1v,False,True,,/r/geopolitics/comments/ye1l1v/the_sco_and_the_shape_of_the_conflict_to_come_the/itxcmyn/,1,False,True,False,geopolitics,t5_2qhnn,r/geopolitics,public,,0,[],,1667882552,1670706591,fe993932d6dced4c0a879e9aa5d7a6e0fbb467f5,2022-10-27 00:07:27,,1.0,,
[],False,,Harmonic_Strategy,1588732434.0,,,[],,,,text,t2_6cpdderd,False,False,"&gt;The point being said here is that SCO has started engaging all regional countries and it will leave a little space for the US to infiltrate into the region, as it did in Iraq, AFG, and other places previously, and make it politically and economically unstable.

*The USA would have been delighted to avoid 9/11. Seriously, it was awful and massively warped the national psyche. Most of the bad stuff of the last 2 decades comes from that.*

If the Afghani Taliban regime and their terrorist puppets Al Qaedi had been stopped by a regional group like SCO, the USA would not have invaded Afghanistan (probably not Iraq either). There was no regional group like the African Union that was capable of anything like that in 2001, and UN blue helmets only work at policing peace agreements and protecting starvation aid. If SCO can actually keep stability and squash terrorism, that would be great. 

&gt;Also, with time, by eliminating mutual frictions, a collective security treaty can be a possibility because with cutting-edge technologies it would be hard for a single country to protect itself, so regional interests will be protected by doing that.

This point doesn't make much sense to me, perhaps you can clarify it. Cutting edge tech means whichever country has the tech has the advantage. If eg Pakistan has stealth fighter jets, that doesn't make India feel more secure / safe just because theyre in a regional diplomatic forum. You have to resolve that kind of tension first with diplomacy, technology has a way of making bad things worse.",True,False,,,,,1,1666827143,,False,0,{},itx7za6,False,t3_ye1l1v,False,False,40990183050.0,/r/geopolitics/comments/ye1l1v/the_sco_and_the_shape_of_the_conflict_to_come_the/itx7za6/,4,False,True,False,geopolitics,t5_2qhnn,r/geopolitics,public,,0,[],,1667882761,1670706584,c3962a70620b8b5b25aa64cbc2150ee944babb4b,2022-10-26 23:32:23,,,,
[],False,,[deleted],,,,,,,dark,,,,,[removed],True,True,,,DELETED,,0,1666825719,,False,0,{},itx4uqn,False,t3_ye1l1v,False,True,40990007907.0,/r/geopolitics/comments/ye1l1v/the_sco_and_the_shape_of_the_conflict_to_come_the/itx4uqn/,2,False,True,False,geopolitics,t5_2qhnn,r/geopolitics,public,,0,[],,1667882901,1670706579,fe993932d6dced4c0a879e9aa5d7a6e0fbb467f5,2022-10-26 23:08:39,,,,
[],False,,OnlyImmortal69420,1640113627.0,,,[],,,,text,t2_hsn2qork,False,False,The SCO has India in it and the CSTO is defacto nonexistent. The Anti NATO coalition has a lot of limits in needs to worry about.,True,False,,,,,0,1666823461,,False,0,{},itwzuhf,False,t3_ye1l1v,False,False,,/r/geopolitics/comments/ye1l1v/the_sco_and_the_shape_of_the_conflict_to_come_the/itwzuhf/,17,False,True,False,geopolitics,t5_2qhnn,r/geopolitics,public,,0,[],,1667883125,1670706570,c54a40865dee2441ac347b24542317afdca05017,2022-10-26 22:31:01,,1.0,,
[],False,,[deleted],,,,,,,dark,,,,,[removed],True,True,,,DELETED,,0,1666822120,,False,0,{},itwwrtb,False,t3_y590s4,False,True,40990829308.0,/r/geopolitics/comments/y590s4/why_doesnt_armenia_simply_give_up_on_russia_and/itwwrtb/,-1,False,True,False,geopolitics,t5_2qhnn,r/geopolitics,public,,0,[],,1667883262,1670706566,fe993932d6dced4c0a879e9aa5d7a6e0fbb467f5,2022-10-26 22:08:40,,,,
[],False,,jyper,1276676107.0,,,[],,,,text,t2_44f90,False,False,"I believe an Independent Armenian state was created after the collapse of the Russian empire. The US planned to give it a good deal of territory from the collapsed Ottoman empire where many Armenians had lived. Independent Turkey and the Soviet Union invaded and Armenia surendered to the USSR as they saw them as a lesser evil.

https://en.wikipedia.org/wiki/First_Republic_of_Armenia",True,False,,,,,0,1666821674,,False,0,{},itwvqbg,False,t3_y590s4,False,False,40983598564.0,/r/geopolitics/comments/y590s4/why_doesnt_armenia_simply_give_up_on_russia_and/itwvqbg/,5,False,True,False,geopolitics,t5_2qhnn,r/geopolitics,public,,0,[],,1667883309,1670706564,192792b49cf677ec89a6caa9703d990fb43d732f,2022-10-26 22:01:14,,,,
